ProductTitle,ProductId,Rating,UserId,Gender
Lotto Men Revorb Black Sandals,19141,2,ADIAFSRTLS7D2,Men
Nike Men Air Twilight Black Shoes,28606,5,AKJKOL1UCJNUV,Men
Puma Men Hypermoto Ducati Black Shoes,33840,1,A1PQINT6WJ78WV,Men
Numero Uno Men Yellow Flip Flops,39546,5,A6XZM6S2T3CCK,Men
Coolers Men Black Sports Sandals,44572,1,AABTNLK9VAXXV,Men
Puma Men SL Tech Lo SF White Sports Shoes,8976,2,A26ZG5TVUDN5NP,Men
Converse Men's AS Canvas HI Black Shoe,3790,2,A18XCWEDZFN7P2,Men
Carlton London Men Semi Formal Black Shoe,2642,3,A3MKZJYTMSIJHM,Men
ASICS Men Gel Enduro 7 Running Silver Sports Shoes,13215,4,A3A5603KICHIFN,Men
Red Tape Men Strappy Black Floater,7330,5,A1FWPNOGNJ8O9A,Men
Nike Men Lunarswift +3 Grey Sports Shoes,31979,2,A21E9S7EG7YML2,Men
Globalite Men White Terra Shoes,44740,5,AYHDKBFFAFEJU,Men
Nike Men's Elite Black Shoe,5467,5,A1XTSL9WZW301S,Men
Puma Men White Aquil Sports Shoes,41232,2,A1KEZ21R9HB37G,Men
Puma Men Jago Ripstop Black Sports Shoes,26596,4,A1H2RD4UOB9FCZ,Men
Fila Men's Agony Black Red Shoe,7754,4,A522HDFW2AVWV,Men
Provouge Men Black Formal Shoes,22136,3,A1KTJVO2QF4O43,Men
Quiksilver Men Blue Flip Flops,40784,1,A8EPBIQG3PIC0,Men
Lee Cooper Men Light cocoa Sandals,57501,5,A492CS4B5Y84A,Men
Lee Cooper Men's LC Casual Denim Blue Shoe,2828,4,AK5WXW5K8EU47,Men
ADIDAS Men Dash Casual Shoes,13685,4,A39ZWMCGVYMZRW,Men
Lee Cooper Men Brown Shoes,26562,4,A3R14060VCWUAD,Men
Asics Men's Gel Cushioning Black Yellow Shoe,3300,1,A1ZO4PLKAGD9NP,Men
Buckaroo Men Bello Blue Casual Shoes,20695,3,A1FX61QFERE8YU,Men
Lotto Men's Calcetto Black Brown Shoe,6440,1,A2VWBE585J5LRT,Men
Nike Men's Dunk Low Blue Shoe,7592,5,A1A03DX9JPURCS,Men
Numero Uno Men Brown Casual Shoes,24463,1,A9CTWLVZ3QSK3,Men
Franco Leone Men Brown Sandals,32506,4,A35X42772AH2Z3,Men
Skechers Men Dark Brown Lifestyle Shoe,3556,4,A2KKJXOD3PWGIA,Men
Timberland Men's Grn Thng Red Flip Flop,6818,4,ACTD54C8DSVIU,Men
Numero Uno Men Green Flip Flops,30251,2,A19JSK4NHQHWY7,Men
Puma Men Evo Ducati Lo White Casual Shoes,8982,2,A198Z2C0LE7SP,Men
F Sports Men White Zero Gravity Sports Shoes,54526,2,A30P09EL7Z8ZGD,Men
Bata Men Lite Black Flip Flops,35511,4,AAGYLJZDWGWVM,Men
United Colors of Benetton Men Charcoal Shoes,37246,3,A39GDKGADFO40R,Men
Lee Cooper Men's Casual Leather Black Shoe,2817,5,ANCW2IEN2G28D,Men
Puma Men Future Cat White Shoes,33847,1,A3LUELTFFICUKN,Men
ADIDAS Men's Black Shoe,2219,4,A2S9JPUPRFHFOM,Men
ADIDAS Men Falcon Elite White Sports Shoes,34850,1,A2J4O74MT63W6G,Men
Reebok Men White Acciomax II Sports Shoes,22109,3,ANTE60OYWFE9Q,Men
Flying Machine Men Black Shoes,49060,2,AP95DEZ9RWUKY,Men
Nike Men Avid Grey Shoes,31946,5,A19RLWRU5XOEY7,Men
F Sports Men Navy Blue Vito Shoes,54519,1,A1CPI87CQOASES,Men
ADIDAS Mens Lightbone Brown Sandal,3569,5,A1OT6N9Y7QPS9T,Men
Skechers Men USA Brown Shoe,18404,2,AFFPRBZZB89LR,Men
ADIDAS Men Duramo 3 M Grey Sports Shoes,9053,4,A3CO07G8QZAFYK,Men
Red Tape Men Mocassins Black Casual Shoes,23679,4,A330QFH749JPP9,Men
Lee Cooper Men  Black Casual Shoe,17814,4,A3DV41BS0CMIW6,Men
GAS Men Grey Pine Flip Flops,17028,4,ACE5OZTM9ZN0O,Men
Nike Men Air Impetus II White Sports Shoes,38655,2,A2DGZ80KV6SHJZ,Men
Puma Men Jiff Black Flip Flops,23813,3,A3U9L1B1WRUVAQ,Men
Reebok Men Grey Premier Trinity Sports Shoes,27640,2,A2D9TG73ZDPA01,Men
Nike Men Dart VII Leather White Sports Shoes,28608,5,A2Z92KUIQ26RSV,Men
Lee Cooper Men White Shoes,41452,1,A39HTATAQ9V7YF,Men
Converse Men's Chuck Taylor Print OX White Canvas Shoe,3594,5,A3JM6GV9MNOF9X,Men
Lotto Men Dolce Vita II Black Sports Shoes,34633,5,A1Z513UWSAAO0F,Men
Woodland Men Black Shoes,50376,5,A1WMRR494NWEWV,Men
ADIDAS Men Blue & Red F10 Sports Shoes,39910,5,A3IAAVS479H7M7,Men
Coolers Men Black Sandals,44544,1,AKJHHD5VEH7VG,Men
FILA Men Trempet White Sports Shoes,25573,2,A1BG8QW55XHN6U,Men
Lotto Men Black Dolce Vita Shoes,44776,5,A22VW0P4VZHDE3,Men
Lotto Men Red Flip Flops,58329,2,A3V3RE4132GKRO,Men
Skechers Men Off White Lifestyle Casual Shoe,3560,1,A327B0I7CYTEJC,Men
Skechers Men Black Casual Shoes,5697,4,AIFAAVTUYHEHB,Men
Nike Men's Mercurial Vic Pink Shoe,4577,4,AVOGV98AYOFG2,Men
Lotto Men White Los Angeles II Sports Shoes,44782,5,A6R426V4J7AOM,Men
Puma Men Brown Vintage Ferrari Shoes,53735,3,AKGB62WGF35J8,Men
ADIDAS Men White Sparta Sports Shoes,40322,4,A3A4C2K3TWDAO5,Men
Flying Machine Men Casual Grey Casual Shoes,14496,3,A3FV2Q7WPZMQPV,Men
Fila Men's Bruno White Shoe,4113,4,A1RXI3A1E99112,Men
ID Men Blue Shoes,26554,1,A26QL1FBQO9C0E,Men
Estd. 1977 Men Grey Sandals,42011,2,A19KEEVZYO1KO6,Men
Reebok Men's Ventilator Ubiq Shoe,1653,1,A1F6HRR58TQ2R0,Men
GAS Men Brown Savana Sandals,56411,3,AVQP6PO1NK0IJ,Men
FILA Men Forza 11 Black Sports Shoes,23489,3,A32IWHU4TUEQZR,Men
Nike Men Lengo Black Sports Shoes,31970,5,ASPJCWRXUOYYY,Men
Globalite Men Grey Tracker Shoes,44749,5,A1LAW520BT5AM0,Men
Clarks Men Brown Formal Shoes,57950,2,A3SWQ2QQ7JBPFA,Men
Fila Men Racer White Sports Shoes,20802,4,A2D7CPCZH5VFVZ,Men
Buckaroo Men Amigo Maroon Casual Shoes,9091,1,A274NIJWOQWE30,Men
Reebok Men's Lazor Brown Flip Flop,5238,5,A2OMU0R0VM5O9I,Men
Lee Cooper Men Brown Sandals,57508,4,A2YFDS6DYGFLVQ,Men
Nike Men Nike air embark Black Sandals,8527,3,AKA7T9TPISJ26,Men
Nike Men Air Relentless Black Sports Shoes,28637,2,AN33X95J5460X,Men
Lee Cooper Men Formal Leather Brown Sandal,2821,4,A2UEOW698J0SSR,Men
Franco Leone Men Casual Black Sandals,11913,2,A22ZFXQE8AWPEP,Men
Nike Men Lunarswi + 2 Blue Sports Shoes,9401,2,A9ZNJ2AXPO652,Men
Lee Cooper Men  Black Formal Shoe,17822,2,A169NC0ZW6XKRD,Men
Asics Men's Gel Challenger 8 Tennis White Blue Shoe,3309,1,AZWRTJPN7NXT,Men
Puma Men Java Brown Flip Flops,23825,5,AH344ZAN5GNOM,Men
Nike Men Downshifter Black Sports Shoes,38663,2,A1YQUT1H2ENJ8U,Men
Quiksilver Men Brown Flip Flops,40779,3,A3C744AK5A6MMI,Men
Quechua Men Arpenaz Brown Sandal,1806,4,A2H6SFTV2892Z8,Men
Timberland Men's Ox Maroon Red Shoe,6811,2,A225CH9TTQPC4B,Men
Red Tape Men Brown Shoes,30258,5,A2F6NPTGDMFXN9,Men
Gas Men Beach Flip Flops,17026,2,A1DC0DSF3H3BCW,Men
Reebok Men's Frisker LP Shoe,1654,4,A3TR91FJ4MNFY9,Men
Flying Machine Men Casual Black Casual Shoes,14491,4,A3IANSH41YHFP1,Men
Fila Men Obsidian Black Sandal,4114,3,A2NRG4NQMLHDJQ,Men
ADIDAS Men Silver Phaedra Shoes,42016,2,A32G79IU2NJ2HS,Men
ID Men Blue Shoes,26553,2,A3L2VTHD6W1E2Z,Men
Lotto Men L500 FG White Sports Shoes,44785,5,A15THVWZS6GQZY,Men
ADIDAS Men White Sport Shoes,40325,2,A1VCW66KPTNUV8,Men
F Sports Men White Bratt Sports Shoes,54517,4,AO5JB67V93FBL,Men
Red Tape Men Black Shoes,30260,4,A1GWD6BDCLGC82,Men
ADIDAS Men's Silver White Running Shoe,3567,5,AJ85OD05LNNUY,Men
Red Tape Men Cross Band Brown Sandals,23677,5,A1E5CS6UI1LWQF,Men
Nike Men Dual Fusion TR III Grey Sports Shoes,35712,2,A1SWCNGOR3GMOQ,Men
ADIDAS Men Eqt Nitro Fashion Black Sports Shoes,15315,4,A2IOZRH02O4C9S,Men
Skechers Men Valence Envoy Black Shoe,5690,3,A1RGXKJ4RFIOCX,Men
Nike Men White Court Shuttle IV Sports Shoes,24452,3,A11OEJ4R1PDTLN,Men
Globalite Men Navy Blue Skid Shoes,44771,3,AZ4FR14IPKML7,Men
Nike Men Air Pegasus Blue Sports Shoes,31948,2,A251DS38L87XWF,Men
Lotto Men Brown Fella Tres Shoes,34634,3,A1Z03R982SX8V2,Men
FILA Men Trempet Black & White Sports Shoes,25574,5,A1ZY0K46FYOTB6,Men
Puma Men Blue Shoes,33849,5,A3MAATZ091QZGE,Men
Provogue Men Black Casual Shoes,57530,1,A35XCJ5P6ZKRE9,Men
Lee Cooper Men Grey Sandals,41455,5,A2B3YKKXVN28TW,Men
Franco Leone Men Brown Sandals,32508,3,A2RDR51FRB58LD,Men
Timberland Men's Desert Walnut Brown Shoe,6816,1,A2MSCG0YX85RL4,Men
Skechers Men's Brown Casual Lifestyle Shoe,3558,5,A2P8AUMTM6O605,Men
F Sports Men White Charger Shoes,54528,2,A3SN6TKIXQI7RP,Men
United Colors of Benetton Men Brown Shoes,37248,1,A1MLJHYS35C4X6,Men
Puma Men Breeze Red Flip Flops,23822,5,A2FTLN4PYZE7S6,Men
Nike Men Liteforce Grey Shoes,38664,4,ATPHIBSTV1NY5,Men
Rockport Men Brown Cashaw Camel Suede Casual Shoes,24835,2,A1QWS6V26JZ5OX,Men
Vans Men Blue Shoes,49435,2,A1VK4ALI1QOF5U,Men
Puma Men Faas 300 White Sports Shoes,26598,5,A1GIXQUBPA0DPT,Men
Vans Men Era Grey Shoes,34861,3,A22L53OZ7IDQX3,Men
Provouge Men Black Classic Formal Shoe,22138,5,AAOU507M8SF9E,Men
Franco Leone Men Casual Black Sandals,11914,3,A2DIOCFQZQFD9O,Men
Arrow Men Red Shoes,39742,5,A17Z7DO3IFHZOE,Men
Lee Cooper Men Leather Semi Formal Brown Shoe,2826,3,A120LZ9VNR3YI0,Men
Skechers Men Black Sneakers,41832,5,A39QH03VD9U048,Men
Fila Men Rambler Olive Flip Flops,20805,4,A95YCV8FK2LCM,Men
Nike Men's Nike Streetgato Black Shoe,5469,2,AP57TEKK91CIM,Men
ADIDAS Men's Adi Liner Brown Flip Flop,5638,3,A3OQ3FVYBU7SBD,Men
Clarks Men Brown Sandals,57934,1,A2GDJP70RVLDKY,Men
ADIDAS Men Adi Stars Tread Black Flip Flops,21188,2,A2BQ8DVGEGWAFY,Men
Gliders Men Black Sandals,35588,1,A2A0EW34FZH9Z7,Men
Fila Men Motor Sports Olive Sandals,11977,2,A1D6UAVLQUS41B,Men
Puma Men Mid Biz Ind White Shoes,44947,2,A2VRUBSVHDDOU9,Men
Red Chief Men Brown Shoes,50749,5,A276N142RFK6EF,Men
Nike Men Air Max Quarter Black Sports Shoes,28653,3,A2HNQ3JHXDSVMW,Men
ADIDAS Men Adi Wind Yellow Flip Flops,19928,1,ADURH4ZDRMZV6,Men
Spalding Men Grey & Orange Flip Flops,3997,3,AXVLSEEYTC4Z9,Men
ADIDAS Men White Snipe Lo Casual Shoes,23841,1,AGGXC77INUISD,Men
FILA Men Dls Circuit 2 Black Sports Shoes,11983,5,A10REFE1TW3ZVT,Men
Numero Uno Men White Casual Shoes,24258,3,A3M7ROZKQW6F69,Men
Nike Men Supergame Black Sports Shoe,17846,5,A271KYL82709TY,Men
Red Tape Men Casual Brown Casual Shoes,12508,2,A1OON4OPP58E26,Men
Basics Men Black Casual Shoes,20892,4,A3COLQK8Y9V9A5,Men
Puma Men El rey Riddim 50s OC Grey Casual Shoes,9001,3,A28H0PAQPYKN94,Men
Puma Men Aquil White Sports Shoes,29123,3,AYI1LDJYGG0ZK,Men
Clarks Men Brown Leather Sandals,50776,3,A3T5EYVSBN3QQX,Men
Enroute Men Leather Tan Formal Shoes,16163,4,A3E4N6O6WC8LEX,Men
Lee Cooper Men Black & White Sports Shoes,41436,3,A30IURTQM5NNA4,Men
Clarks Men Feeling Good Leather Brown Formal Shoes,10294,4,A100GYE1W4OXZ8,Men
Rockport Men Brown Leather Casual Shoes,4183,5,A1ZWS1H6H06Y2J,Men
Ganuchi Men Casual Black Casual Shoes,11948,3,A3BMQUL5QATQIW,Men
Reebok Men White Acciomax Sports Shoes,22958,4,AI5JNFT6YBQQY,Men
Vans Men Maroon Vulcanized Canvas Shoes,49469,2,A2H79ANDK766S1,Men
Timberland Men Brown Casual Shoes,22164,3,A3LO1A9N0F0TXE,Men
Lotto Men Black Campione Flip Flop,44712,5,A2JYNUBR7H2W41,Men
Lotto Men Emeriti Black Slipper,16735,3,A2O9UKJ2FR0GZ4,Men
Franco Leone Men Black Sandals,47197,5,A1O5Z4ZKPMHORQ,Men
Numero Uno Men Black Shoes,13075,3,A366PG2T9L9VSW,Men
Nike Men Air Max Conquer ACG Olive Sports Boot,22732,5,A11AT6B3912DCU,Men
Coolers Men Khaki Sandals,44520,1,A2RCLQ2PS3PN8H,Men
Gas Men Brown Lear Shoes,39974,4,A445U3NN5XBYK,Men
Fila Men Terra Navy Blue Slippers,15382,2,A3GAMJUEB4A4J9,Men
Red Tape Men Grey Casual Shoes,7396,2,A7BCFTL2PU1NZ,Men
ADIDAS Men Spry Wine Black Sandal,3504,2,A87X19PQJFYFA,Men
Numero Uno Men White Casual Shoes,13081,2,A2F5SHIP4HF9,Men
FILA Men Fila Boston White Sports Shoes,15376,5,A305WEYT5UZKCZ,Men
Gas Men Flint Brown Shoes,39980,1,A2E8U0H25VGG3O,Men
Playboy Men Black Shoes,32554,4,A2S1HDSZ0OGW1M,Men
Nike Men's Dual Fusion White Shoe,3160,4,AFRE5F3MKUKME,Men
Gas Men Aventura Sandal,17045,4,A11Q1HQ84F8POH,Men
Fila Men's Mythos White Navy Shoe,4345,5,A2CCV112TWLK7A,Men
Nike Men White Cricket Shoes,1637,2,A2099WPFJKJKZC,Men
Rockport Men CV Wing Black Casual Shoes,15520,5,A1T8YQ4FFMWQPC,Men
Puma Men's Mid Spill Black Shoe,5899,3,AZLE2XFH3JUNG,Men
Nike Men Air Courtballistic White Sports Shoes,12705,2,A99JEK1Z8S1T0,Men
Gas Men Aishley Greyish Purple Casual Shoes,26530,5,A2OCBW6UQ8GS7L,Men
ADIDAS Men's Ridley White Silver Shoe,6620,2,AI6IXAB24N30W,Men
Timberland Men Light Brown Casual Shoes,22190,3,A39HTATAQ9V7YF,Men
Puma Men Aquil Black Sports Shoes,29124,5,A3JM6GV9MNOF9X,Men
Buckaroo Men Red Casual Shoes,40970,1,A1Z513UWSAAO0F,Men
Basics Men Orange Casual Shoes,20895,1,A1WMRR494NWEWV,Men
ADIDAS Men Grey Sports Shoes,12957,5,A3IAAVS479H7M7,Men
Numero Uno Men Black Shoes,45866,3,AKJHHD5VEH7VG,Men
Arrow Men Formal Brown Shoe,23248,3,A1BG8QW55XHN6U,Men
ADIDAS Men White Galaxy Elite Sports Shoes,23846,1,A22VW0P4VZHDE3,Men
Rockport Men Slatkin Grey Casual Shoes,15518,4,A3V3RE4132GKRO,Men
Franco Leone Men Brown Makhani Formal Shoes,44940,1,A327B0I7CYTEJC,Men
Red Tape Men Black Sandals,24099,5,AIFAAVTUYHEHB,Men
Reebok Men Grey Ultimate Vibe Sports Shoes,43359,3,AVOGV98AYOFG2,Men
Fila Men Zoom Black Shoes,39342,4,A6R426V4J7AOM,Men
Coolers Men Black Sandals,44518,3,AKGB62WGF35J8,Men
Nike Men Zoom Hyperenforcer White Sports Shoes,36138,2,A3A4C2K3TWDAO5,Men
Numero Uno Men White Shoes,24260,1,A3FV2Q7WPZMQPV,Men
ID Men Blue Shoes,26537,1,A1RXI3A1E99112,Men
ADIDAS Men's Morin Black Shoe,6627,4,A26QL1FBQO9C0E,Men
Timberland Men Brown Casual Shoes,22197,3,A19KEEVZYO1KO6,Men
GAS Men Grey Skate 002 Shoes,17042,5,A1F6HRR58TQ2R0,Men
Fila Men's Phoenix Black White Shoe,4342,4,AVQP6PO1NK0IJ,Men
Lee Cooper Men Black Shoe,5290,5,A32IWHU4TUEQZR,Men
Clarks Men Rocco Fuse Black Leather Black Casual Shoes,10267,2,ASPJCWRXUOYYY,Men
ADIDAS Men Navy Blue Sandals,3503,1,A1LAW520BT5AM0,Men
Buckaroo Men Victor Black Formal Shoes,9039,5,A3SWQ2QQ7JBPFA,Men
ADIDAS Men Allegra White Sports Shoes,12968,5,A2D7CPCZH5VFVZ,Men
Gas Men Europa Blue Shoes,39987,4,A274NIJWOQWE30,Men
Playboy Men Brown Shoes,32553,3,A2OMU0R0VM5O9I,Men
Puma Men's Tarun White Navy Silver Red Shoe,4514,4,A2YFDS6DYGFLVQ,Men
Red Tape Men's Black Slip-On Formal Shoe,7391,5,AKA7T9TPISJ26,Men
Numero Uno Men Black Casual Shoes,13072,1,AN33X95J5460X,Men
Reebok Men's Trail Mud Slinger Black Blue Shoe,5600,2,A2UEOW698J0SSR,Men
Fila Men Hawai Blue Flip Flops,15385,3,A22ZFXQE8AWPEP,Men
Gas Men Brown Lear Shoes,39973,4,A9ZNJ2AXPO652,Men
Estd. 1977 Men Yellow & Brown Sandals,41869,3,A169NC0ZW6XKRD,Men
Lotto Men Navy Blue Flip Flops,44715,1,AZWRTJPN7NXT,Men
Lotto Men Ridge Black Sandals,33647,5,AH344ZAN5GNOM,Men
Red Tape Men's Black Casual Shoe,7365,4,A1YQUT1H2ENJ8U,Men
Lotto Men Earth Brown Slipper,16732,1,A3C744AK5A6MMI,Men
Franco Leone Men Brown Shoes,47190,3,A2H6SFTV2892Z8,Men
Rockport Men D2N Desert Boot Dark Brown Shoe,4184,3,A225CH9TTQPC4B,Men
ADIDAS Men Mars White Sports Shoes,42086,3,A2F6NPTGDMFXN9,Men
Timberland Men Navy Blue Casual Shoes,22163,5,A1DC0DSF3H3BCW,Men
Enroute Men Leather Brown Sandals,16164,2,A3TR91FJ4MNFY9,Men
Clarks Men Unstructured Leather Brown Sandals,10293,2,A3IANSH41YHFP1,Men
Rockport Men's Tyson Black Shoe,4179,3,A2NRG4NQMLHDJQ,Men
Vans Men Green & Grey Era Shoes,49493,5,A32G79IU2NJ2HS,Men
Vans Men Fontana White Shoes,29576,3,A3L2VTHD6W1E2Z,Men
Puma Men Yacht L Red Casual Shoes,9202,3,A15THVWZS6GQZY,Men
Fila Men Drop Needle Black Slippers,18655,3,A1VCW66KPTNUV8,Men
Red Tape Men Brown Shoes,7398,5,AO5JB67V93FBL,Men
Buckaroo Men loma Brown Casual Shoes,9030,4,A1GWD6BDCLGC82,Men
ADIDAS Men Casual Brown Sandals,12961,2,AJ85OD05LNNUY,Men
Fila Men Coloda Grey Sports Shoes,15378,4,A1E5CS6UI1LWQF,Men
Franco Leone Men Dark Brown Formal Shoes,47199,5,A1SWCNGOR3GMOQ,Men
Puma Men Duncan Multi Slipper,18493,3,A2IOZRH02O4C9S,Men
ADIDAS Men Receptor Navy Sports Sandals,5609,5,A1RGXKJ4RFIOCX,Men
Nike Men Lunar Flow Black Casual Shoes,28662,5,A11OEJ4R1PDTLN,Men
Clarks Men Navy Leather Sneakers,50778,4,AZ4FR14IPKML7,Men
Lee Cooper Men White Sports Shoes,41438,5,A251DS38L87XWF,Men
Ganuchi Men Casual Brown Sandals,11946,2,A1Z03R982SX8V2,Men
Fila Men Hitech White Sports Shoes,23884,2,A1ZY0K46FYOTB6,Men
Carlton London Men Semi oxfords Black Casual Shoes,10635,1,A3MAATZ091QZGE,Men
Lotto Men Atlantica White Sports Shoe,17410,4,A35XCJ5P6ZKRE9,Men
ADIDAS Men Blue Sports Shoes,46080,5,A2B3YKKXVN28TW,Men
Puma Men's Faas Grey Shoes,4522,5,A2RDR51FRB58LD,Men
Arrow Men Black Formal Shoes,45605,3,A2MSCG0YX85RL4,Men
Fila Men Glam II Multi Coloured Shoes,32757,1,A2P8AUMTM6O605,Men
Cobblerz Men Black Formal Shoes,33685,4,A3SN6TKIXQI7RP,Men
Nike Men Wardour Chukka White Casual Shoes,42044,3,A1MLJHYS35C4X6,Men
Numero Uno Men Green Casual Shoes,24256,1,A2FTLN4PYZE7S6,Men
Vans Men Navy Blue Michoacan Shoes,42276,1,ATPHIBSTV1NY5,Men
Nike Men's Lunarswift Blue Shoe,3151,3,A1QWS6V26JZ5OX,Men
Red Tape Men Brown Shoes,12506,2,A1VK4ALI1QOF5U,Men
Lotto Men's Bavarian Black Yellow Flip Flop,6423,4,A1GIXQUBPA0DPT,Men
Fila Men Glam Black Casual Shoes,11979,2,A22L53OZ7IDQX3,Men
Reebok Men Reeflex Run White Sports Shoes,10097,1,AAOU507M8SF9E,Men
Reebok Men Black Fuel Extreme Sports Shoes,43350,1,A2DIOCFQZQFD9O,Men
Enroute Men Leather Brown Formal Shoes,16152,2,A17Z7DO3IFHZOE,Men
Red Chief Men Mushroom Brown Shoes,50747,3,A120LZ9VNR3YI0,Men
Nike Men Dunk High Maroon Shoes,36131,1,A39QH03VD9U048,Men
GAS Men Brown Namib Shoes,39945,3,A95YCV8FK2LCM,Men
ADIDAS Men Star Story Blue Flip Flops,21186,3,AP57TEKK91CIM,Men
Coolers Men Black Sandals,44511,5,A3OQ3FVYBU7SBD,Men
Fila Men Stradd White Casual Shoes,20868,2,A2GDJP70RVLDKY,Men
Nike Men Capri II Mid Grey Casual Shoes,22703,5,A2BQ8DVGEGWAFY,Men
Gliders Men Brown Sandals,35586,4,A2A0EW34FZH9Z7,Men
Kalenji Kiprun 1000 Whi/ Blue 2011,5404,3,A1D6UAVLQUS41B,Men
Ganuchi Men Casual Tan Sandals,11941,4,A2VRUBSVHDDOU9,Men
ADIDAS Men Brown Zapotec Shoes,42088,4,A276N142RFK6EF,Men
Nike Men Lunarglide+ 3 White Sports Shoe,19310,1,A2HNQ3JHXDSVMW,Men
Lotto Men XL Water Man White Slippers,19122,2,ADURH4ZDRMZV6,Men
Reebok Men Blue Possession Flip Flops,43368,1,AXVLSEEYTC4Z9,Men
Puma Men Daemon White Sports Shoes,18494,4,AGGXC77INUISD,Men
Estd. 1977 Men Red & Brown Sandals,41867,3,A10REFE1TW3ZVT,Men
Coolers Men Black Sandals,44529,1,A3M7ROZKQW6F69,Men
Lotto Men Stride Black Sandals,33649,3,A271KYL82709TY,Men
Buckaroo Men Medina Black Formal Shoes,9037,4,A1OON4OPP58E26,Men
ADIDAS Men Snova Glide Grey Sports Shoes,12966,3,A3COLQK8Y9V9A5,Men
Gas Men Skate Blue Shoes,39989,3,A28H0PAQPYKN94,Men
Puma Men SL Tech Lo NM Basic Black Casual Shoes,9205,5,AYI1LDJYGG0ZK,Men
Vans Men Navy Blue Shoes,49494,1,A3T5EYVSBN3QQX,Men
ID Men White & Black Shoes,26539,5,A3E4N6O6WC8LEX,Men
Fila Men Cavier White Sports Shoes,23877,4,A30IURTQM5NNA4,Men
Vans Men Classic Slip-On Navy Blue Shoes,29571,3,A100GYE1W4OXZ8,Men
Timberland Men Black Casual Shoes,22199,5,A1ZWS1H6H06Y2J,Men
ADIDAS Men's Galvin White Silver Black Shoe,6629,5,A3BMQUL5QATQIW,Men
Gas Men Skate Green Casual Shoes,22536,5,AI5JNFT6YBQQY,Men
Estd. 1977 Men Brown Sandals,41858,3,A2H79ANDK766S1,Men
ADIDAS Men Adi Stars Tread Yellow Flip Flops,21181,4,A3LO1A9N0F0TXE,Men
Gas Men Navy Blue Shoes,39942,3,A2JYNUBR7H2W41,Men
Coolers Men Black Pokar Flip Flops,44516,4,A2O9UKJ2FR0GZ4,Men
Puma Men Cabana Racer Sketch White Sports Shoes,8912,1,A1O5Z4ZKPMHORQ,Men
Nike Men Capri II Mid White Casual Shoes,22704,3,A366PG2T9L9VSW,Men
Puma Men Coupe Black Sandal,16969,5,A11AT6B3912DCU,Men
Reebok Men Black Ultimate Vibe Sports Shoes,43357,3,A2RCLQ2PS3PN8H,Men
Enroute Men Leather Brown Formal Shoes,16155,2,A445U3NN5XBYK,Men
Red Chief Men Black Formal Shoes,50740,1,A3GAMJUEB4A4J9,Men
Lee Cooper Men Casual Sandals,22152,5,A7BCFTL2PU1NZ,Men
Puma Men Apex Black Olive Sandal,7730,5,A87X19PQJFYFA,Men
Puma Men Grey Sandals,43959,1,A2F5SHIP4HF9,Men
Nike Men Free Run+ 2 Shield Grey Sports Shoes,15724,3,A305WEYT5UZKCZ,Men
Arrow Men Formal Black Shoe,23246,2,A2E8U0H25VGG3O,Men
Lotto Men's Tennis Mule Navy Blue Flip Flop,6424,1,A2S1HDSZ0OGW1M,Men
Nike Men Black Shoes,42043,3,AFRE5F3MKUKME,Men
ADIDAS Men White Razor Sports Shoes,23848,5,A11Q1HQ84F8POH,Men
Fila Men's Breath White Red Shoe,4141,1,A2CCV112TWLK7A,Men
Rockport Men Altrezlp Navy Blue Flip Flops,15516,1,A2099WPFJKJKZC,Men
Numero Uno Men Black Casual Shoes,24251,1,A1T8YQ4FFMWQPC,Men
F Sports Men White Hurricane Sports Shoes,54542,5,AZLE2XFH3JUNG,Men
Gliders Men Green Esquire Flip Flops,35575,1,A99JEK1Z8S1T0,Men
Arrow Men Brown Formal Shoes,45602,2,A2OCBW6UQ8GS7L,Men
Puma Men's YugoRun White Red Shoe,4525,4,AI6IXAB24N30W,Men
ADIDAS Men Lowell White Sports Shoe,21175,1,A1GWD6BDCLGC82,Men
Carlton London Men Brown Shoes,10632,2,AJ85OD05LNNUY,Men
Numero Uno Men Brown Flip Flops,30235,5,A1E5CS6UI1LWQF,Men
ADIDAS Men Sports Black Sports Shoes,12959,5,A1SWCNGOR3GMOQ,Men
Lotto Men XD III Black Shoes,34635,4,A2IOZRH02O4C9S,Men
Red Tape Men Black Casual Shoes,23682,1,A1RGXKJ4RFIOCX,Men
ADIDAS Men Orange Sports Shoes,46215,1,A11OEJ4R1PDTLN,Men
Converse Men's All Star Canvas Ox Navy Blue Shoe,3592,2,AZ4FR14IPKML7,Men
Fila Men Surveillance White Shoes,25575,1,A251DS38L87XWF,Men
ADIDAS Men's Slide Grey Orange Flip Flop,5665,5,A1Z03R982SX8V2,Men
Lotto Men Hermes Black Sandals,24695,4,A1ZY0K46FYOTB6,Men
Globalite Men Black Skid Shoes,44770,3,A3MAATZ091QZGE,Men
Nike Men Zoom Vomero White Sports Shoes,31949,3,A35XCJ5P6ZKRE9,Men
Provogue Men Mushroom Brown Casual Shoes,57531,3,A2B3YKKXVN28TW,Men
Lee Cooper Men White Shoes,41454,5,A2RDR51FRB58LD,Men
Puma Men Drift Cat Brown Shoes,33848,1,A2MSCG0YX85RL4,Men
Flying Machine Men Casual Grey Casual Shoes,14490,5,A2P8AUMTM6O605,Men
Nike Men's Air Max Lte White Blue Shoe,6642,1,A3SN6TKIXQI7RP,Men
ID Men Black Shoes,26552,1,A1MLJHYS35C4X6,Men
ADIDAS Men White Phaedra Sports Shoes,42017,2,A2FTLN4PYZE7S6,Men
Numero Uno Men's Beige Brown Casual Shoe,6470,2,ATPHIBSTV1NY5,Men
Gas Men Navy Blue Flip Flops,17027,2,A1QWS6V26JZ5OX,Men
Red Tape Men Cross Band Black Sandals,23676,3,A1VK4ALI1QOF5U,Men
Nike Men Jordan Fly Wade Red Sports Shoes,35713,5,A1GIXQUBPA0DPT,Men
Red Tape Men Brown Formal Shoes,30261,3,A22L53OZ7IDQX3,Men
ADIDAS Men's White Silver Running Shoe,3566,1,AAOU507M8SF9E,Men
Nike Men Free Run Blue Sports Shoes,24453,2,A2DIOCFQZQFD9O,Men
ADIDAS Men Ranger White Sports Shoes,15314,2,A17Z7DO3IFHZOE,Men
Skechers Men's Regions Off White Shoe,5691,3,A120LZ9VNR3YI0,Men
Lotto Men White Torcida Shoes,44784,3,A39QH03VD9U048,Men
Bata Men Sandy Blue Flip Flops,35521,3,A95YCV8FK2LCM,Men
F Sports Men White Velocity Sports Shoes,54516,2,AP57TEKK91CIM,Men
Lee Cooper Men's Formal Simpleton Black Shoe,2827,3,A3OQ3FVYBU7SBD,Men
Provogue Men Black Formal Shoes,22139,2,A2GDJP70RVLDKY,Men
Puma Men Faas 300 Blue Sports Shoes,26599,5,A2BQ8DVGEGWAFY,Men
Vans Men Era Black Shoes,34860,5,A2A0EW34FZH9Z7,Men
Franco Leone Men Casual Brown Sandals,11915,4,A1D6UAVLQUS41B,Men
Nike Men's Lunareclipse White Shoe,5468,4,A2VRUBSVHDDOU9,Men
Fila Men Streak White Sports Shoes,20804,2,A276N142RFK6EF,Men
Skechers Men Blue Shoes,41833,3,A2HNQ3JHXDSVMW,Men
Puma Men Driving Power Lo SF Black Sports Shoes,8979,2,ADURH4ZDRMZV6,Men
F Sports Men Black Shoes,54529,1,AXVLSEEYTC4Z9,Men
United Colors of Benetton Men Brown Shoes,37249,3,AGGXC77INUISD,Men
Franco Leone Men Formal Black Formal Shoes,32509,1,A10REFE1TW3ZVT,Men
Timberland Men Blue Thong Flip Flops,6817,3,A3M7ROZKQW6F69,Men
Skechers Men's Casual Brown Lifestyle Shoe,3559,3,A271KYL82709TY,Men
ADIDAS Neo Men Court Sequence Mid Brown Shoes,32951,5,A1OON4OPP58E26,Men
Nike Men Court White Shoe,9407,1,A3COLQK8Y9V9A5,Men
Puma Men Breeze Blue Flip Flops,23823,1,A28H0PAQPYKN94,Men
Nike Men Lunarfly Black Sports Shoes,38665,1,AYI1LDJYGG0ZK,Men
ADIDAS Men Black Twenty2yds Sports Shoes,40323,5,A3T5EYVSBN3QQX,Men
Converse Men Lace Color Black Casual Shoes,24666,2,A3E4N6O6WC8LEX,Men
Nike Men's Incinera Grey Shoe,4576,5,A30IURTQM5NNA4,Men
Puma Men Grey Vintage Ferrari Shoes,53734,5,A100GYE1W4OXZ8,Men
Lotto Men White & Silver Sports Shoes,44783,3,A1ZWS1H6H06Y2J,Men
Skechers Men's Zeta Black Lifestyle Casual Shoe,3561,1,A3BMQUL5QATQIW,Men
Nike Men Court Majestic White Casual Shoes,24454,5,AI5JNFT6YBQQY,Men
ADIDAS Men Aerostar White Sports Shoes,15313,1,A2H79ANDK766S1,Men
Skechers Men Genesis Brown Shoe,5696,1,A3LO1A9N0F0TXE,Men
GAS Men Brown Casual Shoes,56410,2,A2JYNUBR7H2W41,Men
Reebok Men Premier ultra 8 U-form Silver Sports Shoes,10037,5,A2O9UKJ2FR0GZ4,Men
Flying Machine Men Casual Green Casual Shoes,14497,5,A1O5Z4ZKPMHORQ,Men
Fila Men Motor Sports Olive Black Sandals,4112,1,A366PG2T9L9VSW,Men
Puma Men's First Round Takeahike Black Yellow Shoe,7797,5,A11AT6B3912DCU,Men
Numero Uno Men Navy Leather Shoes,34090,2,A2RCLQ2PS3PN8H,Men
Estd. 1977 Men Brown Sandals,42010,2,A445U3NN5XBYK,Men
ID Men Black & Purple Shoes,26555,4,A3GAMJUEB4A4J9,Men
Red Tape Men's Formal Lace Black Shoe,6483,5,A7BCFTL2PU1NZ,Men
Lee Cooper Men White Shoes,41453,3,A87X19PQJFYFA,Men
Flying Machine Men Grey Casual Shoes,22101,5,A2F5SHIP4HF9,Men
Carlton London Men Casual Beige Casual Shoes,13646,5,A305WEYT5UZKCZ,Men
Vans Men Classic Slip-On Grey Shoes,34858,4,A2E8U0H25VGG3O,Men
Puma Men Trek Navy Blue Floater,2211,3,A2S1HDSZ0OGW1M,Men
Lotto Men Blue Flip Flops,58328,1,AFRE5F3MKUKME,Men
Lotto Men Grey Dolce Vita Shoes,44777,5,A11Q1HQ84F8POH,Men
Woodland Men Brown Shoes,50377,1,A2CCV112TWLK7A,Men
Lotto Men Dolce Vita II Grey Sports Shoes,34632,2,A2099WPFJKJKZC,Men
Converse Men's Chuck Taylor Big Check Red Black Canvas Shoe,3595,3,A1T8YQ4FFMWQPC,Men
Fila Men Superior Silver Sports Shoes,25572,2,AZLE2XFH3JUNG,Men
Coolers Men Brown Sandals,44545,1,A99JEK1Z8S1T0,Men
Asics Men's Gel Cushioning Running White Black Yellow Shoe,3308,2,A2OCBW6UQ8GS7L,Men
Puma Men Java Black Flip Flops,23824,2,A11OEJ4R1PDTLN,Men
Nike Men T90 Shoot IV Hg-B Blue Sports Shoes,38662,3,AZ4FR14IPKML7,Men
Quiksilver Men Black Flip Flops,40778,4,A251DS38L87XWF,Men
Lotto Men's Calcetto Brown Shoe,6448,5,A1Z03R982SX8V2,Men
Nike Men  Court Majestic White Casual Shoe,17823,5,A1ZY0K46FYOTB6,Men
Nike Men Dual Fusion Black TR II Sports Shoes,9400,2,A3MAATZ091QZGE,Men
Red Tape Men Navy Blue Shoes,30259,3,A35XCJ5P6ZKRE9,Men
Timberland Men Earthkeeper Burnsh Medium Brown Shoe,6810,4,A2B3YKKXVN28TW,Men
Woodland Men Khaki Shoes,31985,1,A2RDR51FRB58LD,Men
Puma Men Black Roque Sandals,18601,2,A2MSCG0YX85RL4,Men
Nike Men's Air Dictate White Shoe,4549,1,A2P8AUMTM6O605,Men
Skechers Men Black Shoes,41834,1,A3SN6TKIXQI7RP,Men
Buckaroo Men Valle Black Casual Shoes,9090,1,A1MLJHYS35C4X6,Men
Nike Men Dual Fusion TR II Navy Blue Sports Shoes,31971,3,A2FTLN4PYZE7S6,Men
Converse Men's As Canvas Ox Navy Blue Shoe,3798,4,ATPHIBSTV1NY5,Men
Globalite Men White Dribble Shoes,44748,2,A1QWS6V26JZ5OX,Men
ADIDAS Men Court Switch Sports Shoes,13679,2,A1VK4ALI1QOF5U,Men
Franco Leone Men Casual Maroon Sandals,11912,5,A11OEJ4R1PDTLN,Men
Provogue Men Black Casual Shoes,57509,3,AZ4FR14IPKML7,Men
