ProductTitle,ProductId,Rating,UserId,Gender
Reebok Men's Zigfuel White Shoe,5239,2,A251DS38L87XWF,Men
Nike Men The Overplay VI Black Shoes,28636,4,A1Z03R982SX8V2,Men
Lee Cooper Men Formal Leather Black Sandal,2820,3,A1ZY0K46FYOTB6,Men
Nike Men Lunarglide + Shield Grey Sports Shoes,15741,3,A3MAATZ091QZGE,Men
Lotto Men's Calcetto White Red Shoe,6441,3,A35XCJ5P6ZKRE9,Men
Nike Men Zoom Vapor 8 White Red Shoe,7593,4,A2B3YKKXVN28TW,Men
Nike Men's Air Pegasus 27 White Grey Shoe,6673,2,A2RDR51FRB58LD,Men
ADIDAS Men Dash Casual Shoes,13684,3,A2MSCG0YX85RL4,Men
Lee Cooper Men Tan Shoes,26563,4,A2P8AUMTM6O605,Men
F Sports Men Black Charger Shoes,54527,1,A3SN6TKIXQI7RP,Men
United Colors of Benetton Men Black Shoes,37247,5,A1MLJHYS35C4X6,Men
ADIDAS Men Blue Adi Cliff Flip Flop,24462,5,A2FTLN4PYZE7S6,Men
Franco Leone Men Black Sandals,32507,2,ATPHIBSTV1NY5,Men
Puma Men Evo Ducati Lo Black Casual Shoes,8983,4,A1QWS6V26JZ5OX,Men
Skechers Men Black Lifestyle Casual Shoes,3557,5,A1VK4ALI1QOF5U,Men
Numero Uno Men Yellow Flip Flops,30250,2,A1GYOSEAJ5EEK1,Men
Nike Men Lunarswift +3 Grey Sports Shoes,31978,3,AGP8NQ1MCH0A,Men
Red Tape Men's Formal Light Brown Shoe,7331,3,A12K9YFOYOXHAJ,Men
ASICS Men Gel 1160 Running White Sports Shoes,13214,3,A3NR9WJZCAKB40,Men
Puma Men White Aquil Sports Shoes,41233,5,A1ZOGA1A495OHV,Men
Globalite Men White Terra Shoes,44741,4,A264BXIV14DIWA,Men
Coolers Men Brown Sandals,44573,2,A2YWHJXGR6R00D,Men
Reebok Men's Winning Stride White Shoe,5654,1,A2ETF4N62SFLOJ,Men
Lee Cooper Men Brown Sandals,57500,1,AQXX46012LVOT,Men
Red Chief Men Black Formal Shoes,50725,1,A2WZYYQDFVZDZ7,Men
Provogue Men Brown Formal Shoes,22137,5,A2C1VR841W5BHI,Men
Puma Men Gypsy Grey Sandal,2227,2,ATZVCICY66PXZ,Men
Puma Men Faas 300 Black Sports Shoes,26597,1,AGR6NXP9R8D66,Men
Quiksilver Men White Flip Flops,40785,2,A18DY88WBTDFIF,Men
Puma Men Whirlwind Classic Green Casual Shoes,12903,4,A1AUDV6O35S9DS,Men
ADIDAS Men Duramo 3 M White Sports Shoes,9052,4,A2RGINT43SUQ49,Men
Timberland Men Nekkol Grey Black Floater,6826,1,A3Q1XK4NGQJGHF,Men
Skechers Men USA Brown Shoe,18405,1,AASZF2ULVECTD,Men
Nike Men's Air Impetus Shoe,1831,3,A1SGXQTDZ6BJNH,Men
F Sports Men White Velocity Sports Shoes,54518,4,A12377XOL83LBK,Men
Nike Men Ballista White Sports Shoes,38654,2,A1V3QKA6RZE4Z9,Men
Puma Men Jiff Black Flip Flops,23812,2,A35QQ9Z0YSBPUR,Men
ADIDAS Men Black Pural Desman Shoes,42019,5,A25IZEM9CGLBB,Men
GAS Men Black Pine Flip Flops,17029,4,A22ZS7VGA34SM4,Men
Lee Cooper Men  Black Sandal,17815,2,A3RZB4IQ17Y7VX,Men
Decathlon Men Black F300 Sports Shoes,24805,5,A2FSA9BJC7O7X7,Men
Franco Leone Men Black Formal Shoes,11924,1,A173D8H9C18PCI,Men
Vans Men Bedford Charcoal Shoes,34851,5,A2SBLI6XGBI1GK,Men
Puma Men F1 Black Sandal,2218,4,A7LEHTDY7Z1PD,Men
Fila Men Torando Black Sports Shoes,28600,2,A8WHCF3SY0L15,Men
Puma Men Future Cat Black Shoes,33846,3,AXH81K09PSKLL,Men
Nike Men's Dual Fusion Grey Shoe,5459,1,A2PZ830VJ2GZEZ,Men
Nike Men Air Pegasus Grey Sports Shoes,31947,5,A1OVF6WMXX9CBS,Men
ADIDAS Men Slimsoll White Sports Shoes,8346,3,A3E60CSK5WW8BQ,Men
Flying Machine Men Brown Shoes,49061,1,A319PGL9XMNT6A,Men
Nike Men's Zoom Vomero 5 Grey Blue Shoe,6680,5,A2JPOCC17QIOUI,Men
Provogue Men Black Formal Shoes,22130,3,A1DPSUISPJG4K6,Men
Puma Men Carbon Black Sandal,2220,1,APKFDTZU2MX0K,Men
ADIDAS Men Running White Sports Shoes,13677,3,A1H549TTDWKPCK,Men
Puma Men Aqua Cat II Power Black Flip Flops,26590,1,AF7UW6L8OIKS7,Men
Quiksilver Men Multi Coloured Flip Flops,40782,1,A11J7PLZJ99M7O,Men
Lee Cooper Men Black  Sandals,57507,3,AWQNOD7X9273P,Men
Nike Men Dart 9 Leather White Sports Shoes,28638,5,A3RCCDL4Y1XZDJ,Men
Reebok Men Navy Blue Turbo DMX Shear Sports Shoes,43335,5,A10205RFE66H1R,Men
Nike Men Nike air max limitless Black Sports Shoes,8528,5,A36NPWR62GGB90,Men
Puma Men 65cc Ducati Red Sports Shoes,8970,5,AU5Z287G31579,Men
Enroute Men Formal Black Formal Shoe,17481,5,A3QKZZ3Y3FM21N,Men
Flying Machine Men Charcoal Shoes,49059,4,A1JLP1MLTJZPJ7,Men
Nike Men's Downshifter Lea Black Shoe,5461,1,A123AJQJYJY5Z5,Men
Globalite Men Olive Sparta Shoes,44746,3,A1J3YHEET4SV5G,Men
Puma Men TX-3 Green Casual Shoes,8984,1,A185Q4S3NFOUOZ,Men
Force 10 Men Beige Sports Shoes,35725,1,A2B4MXLEP42IQH,Men
Skechers Men's Brown Lifestyle Shoe,3550,2,A189H8NPEQN58F,Men
Red Tape Men Grey Shoes,30257,4,A1R2MKM2YT5ND0,Men
Converse Men Red Flip Flops,17647,4,A23UV2QRYP8PX4,Men
F Sports Men White Vito Shoes,54520,3,A1N9AIQ75P3J5W,Men
United Colors of Benetton Men Brown Shoes,37240,2,A18U3OPGXGQSMO,Men
Nike Men's Egoli White Black Shoe,4547,4,A147FGQTHCMO6R,Men
ADIDAS Men Adi Quest Blue Sports Shoes,13683,3,AWM0V317JA4X5,Men
Asics Men's Gel Phoenix 3 Running White Black Shoe,3306,5,A1B2BDWB519WIW,Men
Quiksilver Men Black Flip Flops,40776,3,AVIFRWR2YKO73,Men
Nike Men Ballista II White Sports Shoes,15746,4,A11V6R6WZ5ZQV2,Men
Lotto Men's Calcetto Grey Shoe,6446,2,A14IT4G4FZFEP6,Men
Converse Men Multi Coloured Flip Flop,39311,3,A2E2FYUPAO2M0R,Men
Lotto Men White Skateboard Shoes,44779,4,A2WTWKGP9WES1Q,Men
Force 10 Men White Sports Shoes,36957,2,A3D0SBB68TTET,Men
Nike Men Dart VII White Sports Shoes,28607,3,AL74FP10LMX8Y,Men
Lotto Men Sting Black Sandals,19140,1,AYTK85H56WQ5F,Men
Numero Uno Men Red Flip Flops,39547,1,A18M9192WX98HP,Men
Puma Men Drift Cat White Shoes,33841,2,A13W8KHF7Y1S51,Men
Franco Leone Men Formal Brown Formal Shoes,11923,2,A2OP35XWVTJYDK,Men
ADIDAS Silver Astar ride 3M Sports Shoe,13648,4,A2P5RDTIGF6XRO,Men
Vans Men Classic Slip-On Black Shoes,34856,2,A2KG1LYT548UFB,Men
Redtape Men Brown Formal Shoes,19372,3,A1JKZAOB9S4DF2,Men
Decathlon Men Quechua Grey Sports Shoes,9431,3,A2ZMU9L93JSFSR,Men
Reebok Men Raceon White Sports Shoes,10039,5,A3GDBKK2C9PXFS,Men
Nike Men Avid Black Casual Shoes,38653,1,AMQDTJZRXBPCR,Men
Flying Machine Men Casual Green Casual Shoes,14499,4,AWYRXPZS8TRGJ,Men
Puma Men's Manilla Hi White Shoe,7799,1,A2T4Y9EBPRLWB0,Men
Puma Men Evo Black Casual Shoes,23815,1,A27TQSFIAZX3ET,Men
Nike Air Visi Sleek Shoes,1836,2,A2W26TXNIF6OFH,Men
Nike Men's Mercurial Gli Red Pink Shoe,4578,5,A1TKC6GRRBJA4T,Men
Puma Men Future Cat M1 Engine Red Sports Shoes,12904,3,A1TNQ0QMWCUBCL,Men
Timberland Men City Brown Floater,6821,3,ALKCBFG5L6FCJ,Men
Skechers Men USA Black Shoe,18402,4,A31A7SV73QLTZS,Men
ADIDAS Men Adi Fiero M White Sports Shoes,9055,2,AL4QPSP65J7IE,Men
Skechers Men's Liquid Roggers Brown Shoe,5698,3,A3VJPW9T8D6P4Q,Men
Red Chief Men Black Sandals,39297,2,A1KEESMVTONAGJ,Men
Provogue Men's Formal Black Shoe,7881,5,AKYM22HHJ4576,Men
ASICS Men Gel DS Sky Speed 2 Running Blue Sports Shoes,13198,5,A2UW1YLL8TKAVZ,Men
Provogue Men Formal Black Formal Shoes,12876,2,A3QJSZDRC4DXB9,Men
U.S. Polo Assn. Men Brown Flip Flops,35668,2,AVISXECDOZRGQ,Men
Playboy Men Orange Casual Shoes,47248,4,A1BFS260JO9TZJ,Men
ADIDAS Men Brown Sandals,39899,4,A2T63MAMWZQ46C,Men
Puma Men Hopper Black Sandal,17960,3,A16JWRFT5IHYRA,Men
Red Tape Black Men's Semi Casual Shoe,2399,5,A2FBYXWTRB3TN3,Men
Puma Men's Basket Biz White & Blue Shoe,2963,4,A2ML3OG7R68XFP,Men
Playboy Men Grey Flip Flops,11851,1,A1EGRLCSMRGOOX,Men
Woodland Men Brown Shoes,22841,2,A22FYS1K1E18ET,Men
Puma Men White 3.0 Mid Shoes,43876,1,AF508G9N8T5OY,Men
Red Chief Men Black Formal Shoes,39263,3,A2VB5TIINLFO7B,Men
Fila Men Sports White Shoes,12882,5,A1HB4DFQC6ZGHW,Men
FILA Men FILA Boston White Sports Shoes,15406,5,A104D62WJII6KP,Men
United Colors Of Benetton Men Latnam Black Casual Shoes,10174,5,A5ZBX8PFDNIKE,Men
ID Men White & Blue Casual Shoes,57481,2,A2Z53Z2IXPFE4A,Men
Ganuchi Men Brown Shoes,31693,2,A1BT4VX5UXV2P9,Men
Fortune Men Black Formal Shoes,35233,1,A23I9CZ4MCWD7G,Men
ADIDAS Originals Men SL 72 Red Casual Shoes,15250,5,AUL78LW1ZS9EW,Men
Vans Men Black & Red Casual Shoes,59943,3,AA51P4U4RMPQE,Men
U.S. Polo Assn. Men Brown Shoes,35657,1,A3UW44EC9K7SP2,Men
Fila Men Benton Grey Sandals,34785,5,A3GPN4M7QLFT2L,Men
Franco Leone Men Blue Shoes,35465,3,A15HBNI7E4H4I2,Men
Numero Uno Men's Dark Blue Shoe,6362,3,AFD1XMFDOUYW8,Men
FILA Men Hostile White Sports Shoes,23500,3,A3CGZE3WU9FFML,Men
Franco Leone Men Brown Sandal,15062,3,A2LR2XYBPSDPS,Men
Force 10 Men Brown Shoes,44406,1,A72QEHDVRNTBC,Men
Clarks Men Manly Alpine Brown Casual Shoe,21091,4,ABODWS6KT9V1W,Men
Numero Uno Men's Casual White Canvas Shoe,2504,4,AL7CQDK6QOGNF,Men
Rockport Men's Allander Black Shoe,7244,2,A26SAG6L9SBH08,Men
Bata Men Mocassino Brown Formal Shoes,35491,1,A31TGG4GXEBG0Q,Men
Lotto Men Revenge 02 Beige Grey Floater,6396,2,A13RB9IGV06SRF,Men
Red Tape Men Brown Formal Shoes,34543,3,A31H6EDAGQ4N52,Men
ADIDAS Neo Men Court Evo Blue Shoes,33766,1,A6CGFXIVJNRG0,Men
Red Tape Men Black Leather Casual Shoes,20715,4,A3UZ13EXH4MO9D,Men
Lotto Men White Sports Shoes,39638,2,A1IJO0HZ1ONCWH,Men
United Colors of Benetton Men Speeder Yellow Flip Flops,10180,5,A1UXVUM6G2H7D6,Men
Spinn Men Dozer Black Shoes,36442,1,AEU1BMGTLIUNO,Men
Btwin Sport 5 Shoes,5345,1,A328HZ1HAUPEY9,Men
ID Men Black Sandals,57475,5,A3G5CK0SAWTMK6,Men
Converse Men All Star Black Shoes,24187,2,A25PEHBZLLHTTF,Men
Carlton London Men Casual Brown Casual Shoes,13537,5,A3A36DP9IJPRPF,Men
Nike Men Air Max Turbulence White Sports Shoes,12885,5,A108HJD2ESJXUY,Men
Puma Men White Benecio Shoes,34749,3,A2Z3DE1JHTWYQX,Men
Red Tape Men Black Shoes,28316,2,A32ZF8TRWMR1B9,Men
Red Chief Men Black Formal Shoes,39264,3,A224SVFBOORJRM,Men
Timberland Men Juniors Beige Casual Shoes,13359,4,A2T7A5AIJI9CCF,Men
Playboy Men Casual Red Slippers,11856,1,A1296LFHAMDOYP,Men
Woodland Men Khaki Casual Shoes,22846,1,A77EO8HXDT3II,Men
Puma Men White Driving Power Lo Shoes,43871,4,A36M0NAGBV38SU,Men
Puma Men's Match Classic White & Green Shoe,2964,4,A3LMILRM9OC3SA,Men
Carlton London Women Black & Gold Toned Flats,59051,1,A1ZEFDGH5VS0EQ,Women
Catwalk Women Leather Brown Flats,2886,4,AQZ2MQC5NXN9,Women
Rocia Women Black Flats,54118,2,A2K8K9WVD7FNMG,Women
Catwalk Women Leather Flats,2872,1,A1E6KFB5MUA6JD,Women
Crocs Dora Boots Pink Sandals,8574,4,A3AVQBR7HHOE1X,Women
Catwalk Women Gun Metal Grey Heels,11518,2,A30IP88QK3YUIO,Women
iPanema Women Red Flip Flops,49839,2,A23JG9NJNQ3WXO,Women
Carlton London Women Silver Wedge Sandal,2618,4,A3437C79W6IORP,Women
Portia Women Copper-Toned & Brown Sandals,47530,1,A2RDQX62GRK6SU,Women
Rocia Women Black Heels,54127,5,APBQH4BS48CQO,Women
Skechers Women Green Shoe,4140,4,A2T5IANBMPPQQ7,Women
Catwalk Women Brown Sandals,53130,5,A3FE8W8UV95U6B,Women
ADIDAS Women Lavender Hagkok Sports Shoes,46086,1,A3DG2I5KGLK73K,Women
Nike Women Free Run Pink Sports Shoes,36137,1,A4QK28MB0Y8R8,Women
ADIDAS Women's Adi Groove Blue Flip Flop,5630,3,A2550BO5C6CC4O,Women
Inc 5 Women Brown Heels,13042,2,A126J8DRHTQBT0,Women
Catwalk Women Golden Wedges,55657,4,A30NKV5H3TPHIT,Women
Rocia Women Copper Sandals,34452,2,A1EVGDOTGFZOSS,Women
Carlton London Women Wedge Silver Sandal,2627,1,AJAT0Z7G78AKG,Women
Kalenji Ekiden 200 Wn Purple 2011,5402,5,AP5WTCMP6DTRV,Women
Lotto Women Coral Elegant Flip Flops,44725,1,A21IM16PQWKVO5,Women
Enroute Women Casual Black Flats,14431,5,A1TLDR1V4O48PK,Women
Reebok Women Charcoal Grey Fuel Techno Sports Shoes,43356,5,A2PHMQ53HYJX5E,Women
Enroute Women Casual White Heels,14409,2,A2W5CUXW018S4X,Women
Puma Women Grace Silver Sandals,29583,3,A3VCJ1D1Z4J8W,Women
Lotto Women XL Kelly Pink Slippers,19124,1,A29WF3KXZ6C1OD,Women
Puma Women Kuris Silver & Grey Sports Shoes,33825,1,AY4CBEDCI5Y2V,Women
Carlton London Women Blue & Cream Shoes,59056,4,A21E3CB2A1B149,Women
Rocia Women Black & Brown Sandals,45409,1,A3ON6E699JT6CE,Women
Reebok Women Reeflex Run Blue Sports Shoes,10096,3,A2ONROQ0ITT7HX,Women
Rocia Women Black Shoes,34455,5,A1O2WUVJ9OKUTO,Women
Catwalk Women Casual Black Heels,20267,2,A6F8KH0J1AVYA,Women
Lotto Women Red & Orange Disco Holic Flip Flops,44722,5,A2MMRRW7920RM,Women
Nike Women Beige Dunk High Casual Shoes,22702,2,AXPKZA7UZXKTT,Women
Inc 5 Women Casual Maroon Sandals,13045,4,A25PW8VQJ611EA,Women
Catwalk Women Multi-coloured Heels,55650,4,A1ZLDDN5J9CFIO,Women
ADIDAS Women Polka Pink Flip Flops,24633,4,A3VJUKZWK13TRI,Women
Catwalk Women Brown Sandals,53137,5,AB4OYPWGHYAPO,Women
Portia Women Brown Flats,47537,4,A2SIAYDK7GG7QA,Women
Rocia Women Beige Flats,54120,5,A1JCFYU0BE7XTI,Women
Nike Women Glide White Grey Shoe,4147,3,A3G5OBREQKB7FR,Women
Puma Women Purple Techno Sandals,43956,4,A2K8SAFPHOJSG9,Women
iPanema Women Blue Flip Flops,49808,3,A3GJFDRP3Q8GV5,Women
Inc.5  Women Grey Flats,22539,3,A1B9QR40IL84M4,Women
Carlton London Women Four Strapped Black Sandal,2629,4,A1ONB0P2P4V81E,Women
Rocia Women Beige Flats,54129,5,A34EQAIKKUWYYW,Women
iPanema Women Pink Flip Flops,44189,1,A1B93VD33V6JGK,Women
Rocia Women Brown Wedges,57303,3,A1HGNPI5XWPA5C,Women
Catwalk Women Lifestyle Black Heels,11516,1,AABAFCMZHEO1U,Women
iPanema Women Blue Flip Flops,49837,1,A3KK59I1TY3MRB,Women
Catwalk Women Blue Casual Flats,27074,1,A3UQXHI88S7XAX,Women
Carlton London Women Gold Wedge Sandal,2616,5,ATLDUADWJMTT0,Women
Enroute Women Turquoise Blue Flats,35783,4,AUM9K0KZGK653,Women
Nike Women Grey Lunarglide +3 Sports Shoes,22734,1,A3I1F82WEKU6PG,Women
Fila Women Top Fuel Black Sports Shoes,34651,5,A2Y4DGV80FJKWD,Women
Catwalk Women Red Flats,46615,2,A9ZWBJK55DLZ9,Women
Catwalk Women Bronze toned Sandals,30695,5,A3BKEDXQG5HLRR,Women
Reebok Women Black Casual Shoes,43367,5,A3HMLMXJ5YQURK,Women
Clarks Women Brown Leather Heels,10292,2,A3UTG1EE19J916,Women
Clarks Women Cream Coloured Onslow Beat Leather Wedges,50784,4,ADWMDQ9CFNTA1,Women
Catwalk Women Wedding Heeled Bronze Heels,2888,2,A39J2GNAMPZF2W,Women
Rockport Women Jeanie Oneband Brown Flats,15526,5,AAGYIGVSH2MIX,Women
Rocia Women Maroon Sandals,54116,2,A36F3MHL9JD8ET,Women
Fila Women Sleeker Green Check Casual Shoes,23878,5,AWHWO1LUI8J1X,Women
Nike Women Downshifter White Sports Shoes,12703,4,A2XTD715SMBVX3,Women
Puma Women Speeder Wns Ind White Sports Shoes,53757,3,A1RON1NZIGQNBO,Women
Catwalk Women Silver Flats,27080,5,A2LWZYTCZ9IDRV,Women
Rocia Women Maroon Sandals,45400,1,A2MD9XAN2I6SE5,Women
Catwalk Women Blue & White Sandals,53139,4,AA394CGT3GNYH,Women
Rocia Women Casual Black Sandal,16995,1,A9MYCYZT8EMMX,Women
Portia Women White Flats,47539,2,A33WIH2J5U3UXL,Women
Portia Women Brown Sandals,56679,1,ATX9OC5P7XBM0,Women
Nike Women Free White Pink Shoe,4149,5,A1XQFWZJBKLEER,Women
Crocs Women Abf Single Flip Slippers,8542,5,A2ORHBGD20H0OH,Women
Catwalk Women Bronze Heels,43951,4,AQ3DINQH0WH46,Women
Enroute Women Casual Yellow Heels,14438,1,A1AULGMNH7SO2V,Women
ADIDAS Women Adi Light White Fresh Shoe,3505,4,A45MRF677Z7PX,Women
Rocia Women Brown Sandals,45407,1,A1G56R3VVU6VRE,Women
Lotto Women Osaka Grey Violet Shoe,4512,2,A2M7AR6AFHZ62R,Women
Rocia Women Copper Flats,54111,1,A1NIA6OW0N4LOO,Women
Clarks Women Black Onslow Beat Leather Wedges,50783,2,A3ARZHCCRQRHRA,Women
Catwalk Women Brown Wedges,46612,1,A12R85X0ED2JUQ,Women
Catwalk Women Brown Heels,30692,2,A1KEIWYH8085EZ,Women
Enroute Women Black Shoes,35784,1,A14D2QHC2B1NQN,Women
Rocia Women Brown Wedges,57304,1,A1ZB60L19B5YZT,Women
Catwalk Women Lifestyle Gold Toned Ballerinas,11511,1,ALLPYLE7WAY1L,Women
Catwalk Women Beige Casual Shoes,22501,3,A2I8WY04NM1FR,Women
iPanema Women Pink Flip Flops,49830,1,A1U94C08ZTAYE,Women
Carlton London Women Stylish Gold Flats,2611,1,A3827WHBKQQF8T,Women
HM Women Silver Heels,56878,2,ABH3MVCY6IGA9,Women
Catwalk Women Heeded Golden Strap Black Heels,3135,3,A34FMN6PYDDU6V,Women
Rocia Women Brown Heels,17010,4,AP238VB80KHTC,Women
Lotto Women's Cross Color Black Pink Flip Flop,6447,3,A1GNZ4F1S6VTSH,Women
Nike Women Ten Blue White Shoe,7595,5,ATRSMN161M9GU,Women
ADIDAS Women Duramo 3 Sports Shoes,13682,4,AVOF2TL7T400U,Women
Rocia Women Brown Flats,54145,3,A3DPSWDPSG2LTE,Women
Portia Women Brown Heels,47552,4,A3HH9WA1LOMK9P,Women
Catwalk Women Multi Colour Flats,39579,2,A2FYGUHALQQYK8,Women
Nike Women's Izanami White Blue Shoe,6681,3,AXBDO994983U6,Women
Enroute Women Casual Black Flats,14453,3,A2E9OLOQRK7M8T,Women
ASICS Women Gel Spree Running Grey Sports Shoes,13212,5,A2J7HM7CIZ3CTD,Women
Rocia Women Black & Brown Flats,50175,1,A17O4CBSO0SKB7,Women
Nike Women's Double Team Lite Black Shoe,5460,2,A3LURPBMK4ZDIR,Women
Catwalk Women Gold Heels,55635,2,A3L7YV2UCQ7ZX,Women
Roxy Women Pink Flip Flops,40748,1,A2T2Y8FW0NLILV,Women
Nike Women Double Team Lite Black Shoes,38652,4,A2PZOIS5NOHEA,Women
Catwalk Women Gold Flats,33088,3,A3GFGEY12ATN4G,Women
ADIDAS Women Duramo 3 White Sports Shoes,9054,2,AYYB9EFFG2GVA,Women
Timberland Women's Estela Umbrella Green Flip Flop,6820,3,A2IW10BPHCYQG2,Women
Puma Women Casual Purple Casual Shoes,12905,3,A2D3A9A58X5RMZ,Women
Carlton London Women Black Heels,59033,1,A3GA66GJ70SG7A,Women
Nike Women Zoo Blue Shoe,4579,5,A35PF7XADVB60C,Women
Catwalk Women Buckel Pink Flats,17679,1,A2CVC21HIZ1PO7,Women
Catwalk Women Slim Casual Beige Wedges,8172,3,AG0MJ41NXPM35,Women
Lotto Women Lavender Flip Flops,58327,2,A2OHAJBHJK2Y3E,Women
Nike Women Air Rift Grey Shoes,31941,3,A3SR4T76JKA0QR,Women
Portia Women Black Flats,47599,1,A2FB1KU4IY812V,Women
Catwalk Women Black Flats,55632,3,A2285KGCYXO71H,Women
Inc 5 Women Casual Gold Flats,13027,4,A16D9H9KJCRV1Y,Women
Rocia Women Multi- Coloured Shoes,50172,2,A2P19WZ6WD2OZK,Women
Enroute Women Casual Taupe Casual Heels,14454,1,AKRUFGYZHI8P1,Women
Catwalk Women Brown Heels,49609,3,A28H72UFHPN9QN,Women
Inc. 5 Women Casual Beige Heels,22304,4,A2DMIEUMKD3VYD,Women
Rocia Women Beige Sandals,54142,2,A2Z89FDEA8TLZ2,Women
ADIDAS Women Sukoi Black Sports Shoes,42027,5,A1KHY2OJNT409Z,Women
Nike Women Dunk Skinny White Red Shoe,6672,5,A33MKXDOOI6T0R,Women
Portia Women White Heels,47555,3,A2SZCH2I05ZETG,Women
Nike Women Air Relentless Grey Sports Shoes,15740,5,AK4E5J6IVE11R,Women
Rocia Women Casual Brown Sandal,17017,4,A1KQ79CU1EA754,Women
Skechers Women Tone Black Sandals,11925,2,AGBK2UBSBV0OR,Women
Catwalk Women Silver Heels,41669,1,A3K5ZI737LDUOG,Women
Catwalk Women Casual Brown Flats,8175,1,APKI65S1D3AHW,Women
Inc 5 Women Casual Black Flats,13018,2,A1XMC5AMIQKVJV,Women
Timberland Women Belle Isld Boat Ball Black Floater,6827,3,AXJAR4KM54KVW,Women
Puma Women Cabana Racer SL Black Casual Shoes,12902,1,A1FOI078VYL0BP,Women
Carlton London Women Black Heels,59034,1,A19VPNGSJK19PE,Women
Senorita Women Green Flats,35378,3,A396ZSFP8XV4O1,Women
Enroute Women Casual Gold Peep Toes,14462,1,A1ZKE84PVHR3N9,Women
Portia Women Beige Wedges,47597,4,AIQMY3PN8ZF9,Women
Rocia Women Brown Flats,13475,3,A28PWHLR92QPQS,Women
Catwalk Women Ballerina Black Casual Shoe,17683,5,A27XYPIP5FQUZT,Women
ADIDAS Women Neo Feather Blue Sandals,15312,1,A2TV0VZJI1ZD33,Women
Nike Women Court Majestic White Shoes,24455,3,A3374Z6CYWF8YK,Women
Catwalk Women Weaved Strap Tan Flats,17677,5,A1O8JBGRANCVEO,Women
Catwalk Women Casual Black Heels,15544,2,AA75INOMAHULX,Women
Nike Women Transform III IN White Shoe,6644,2,A1RFITZDNVIA0T,Women
Portia Women Black Sandals,47563,3,A5GI8R9A9IFV3,Women
Rocia Women Black Flats,13481,3,A3LEGZWFK44DJ8,Women
Rocia Women Casual Black Sandal,17021,5,A1VW4D5B59VZQW,Women
Catwalk Women Red Flats,33086,4,A3VMD3B59TAB85,Women
Catwalk Women Multicoloured Heels,46822,5,AM6TZU9POUAL,Women
HM Women Red Heels,56882,1,AVYRG8E15WAK7,Women
Catwalk Women Pink Flats,39577,4,A1D6EV5BKMM8OU,Women
Catwalk Women White Flats,49600,3,A4BTNUSVHTE0I,Women
ADIDAS Women Blazer Sports Shoes,13678,5,A1EVAE0Q2E2V0K,Women
Catwalk Women Black Heels,43934,2,A2DO226S09AIEG,Women
Catwalk Women Red Flats,39583,3,A32AIFEBI1X4MR,Women
Lotto Women's Cross Color Beige Black Flip Flop,6449,5,A248P6F309UXRF,Women
Puma Women Roque Grey Sandals,18600,3,A2F1CMMQ2M7IIQ,Women
Nike Women Sweet AC Black Shoe,4548,2,A2575DBNU90OA6,Women
HM Women Blue Heels,56876,3,A10GKM76NOQLGE,Women
Catwalk Women Casual Brown Wedges,15543,2,AH7S8WUFHIBIC,Women
Portia Women Brown Sandals,47564,3,A3HDFRFKJAGS97,Women
Nike Women's Transform III IN Black Pink Shoe,6643,3,A258GDNRBC6BC1,Women
Nike Women Iza Black Shoe,4570,4,A2PV4WPV010BDP,Women
Puma Women Green Supersuede Eco Casual Shoes,53732,4,AWXLQX6FSEZA1,Women
Catwalk Women Fancy Black Heels,17670,1,AHH534KJMCNRF,Women
Nike Women's Lunar Swift White Blue Shoe,6829,1,AXBF3OLBP9QP6,Women
Numero Uno Women NY Grey Blue Shoe,4742,5,A2A6TB2DZ99DB,Women
Catwalk Women Ballerina Grey Casual Shoe,17684,4,A3GDFAUEOR245Y,Women
Inc 5 Women Casual Brown Wedges,13016,3,A3RUXBGZOQLC1G,Women
Catwalk Women Black Heels,41667,3,A15UJADUAS68JI,Women
Carlton London Women Purple Flat Shoes,13640,1,A29UK7GM2HXMIE,Women
Portia Women Green Sandals,47590,3,A2FE974F8E51WC,Women
HM Women Black Sandals,56871,5,A2BYP56Q0QBU1Z,Women
ADIDAS Women Purple Chill Sports Shoes,42029,3,A2QD105KDRZ46J,Women
Catwalk Women Black Heels,39584,4,A1XZVQED7H3403,Women
Senorita Women Black Flats,45802,5,A3E1969PZ33LO9,Women
Rocia Women Casual Brown Sandal,17019,3,A1LJ2H84ERZ9SA,Women
Catwalk Women Black Heels,43933,4,A1AM1BP28NQXLF,Women
Catwalk Women Black Heels,39570,2,AV03O68PRMGJE,Women
Catwalk Women Brown Heeled Shoes,49607,3,A7FPJ94ABSYM9,Women
HM Women Red Heels,56885,4,A2V37AQ1VOMBH0,Women
Rockport Women Beige Flats,17489,3,A3UN53B7B5WV5X,Women
Puma Women Saba Ballet DC3 Purple Casual Shoes,8978,5,A27D7TJZTU8B15,Women
Catwalk Women Off-White and Blue Pumps,46825,5,AVWOHZE2VTGVJ,Women
Nike Women Lunarswift +3 Olive Sports Shoes,31977,3,AQVFWCBC5AXZS,Women
Crocs Women Crle Plterm Black Floater,8771,3,A3NDJI4IP8ICI9,Women
Catwalk Women Beige Shoes,43950,1,A1SJ5LNTEM67RO,Women
Portia Women Maroon Flats,47538,4,AZYQEFB9Y5N22,Women
Nike Women Glide White Pink Shoe,4148,5,A8QGU7RYBF5VY,Women
Catwalk Women Blue Heels,53138,5,ASWVTM2VOKKLO,Women
Rocia Women Casual Black Heels,16994,3,A1QDJA5DFFAL6C,Women
Catwalk Women Brown Heels,30693,1,A1T4QM0WQZ23L9,Women
Catwalk Women Multi Coloured Sandals,46613,3,A36UQ20T9VVUAW,Women
Rocia Women Black Heels,57305,3,A16OJ5ISFFKC34,Women
Catwalk Women Lifestyle Beige Flats,11510,1,ATO4SYWWBB1QX,Women
Carlton London Women Stylish Black Flats,2610,3,A1QV5IH6HDRN0L,Women
iPanema Women Blue Flip Flops,49831,2,A1RFBE2LHNLHPI,Women
Catwalk Women Blue Casual Shoes,22500,4,A2LXAR7KEDFTJ9,Women
Enroute Women Coral Shoes,35785,1,A34YKNAF8ZQF57,Women
Catwalk Women Black Casual Flats,27086,4,A2EP4HWJ0L6D5H,Women
Rocia Women Black Sandals,45406,3,A1JZTT5WQU8O26,Women
Nike Women White Court Shuttle Shoes,26702,3,AV7TWUEV79X52,Women
Catwalk Women Blue Casual Shoes,21715,3,A22V34L77QYLGD,Women
Rocia Women Black Flats,54110,1,A3DWLT4X15P9PZ,Women
ADIDAS Women White Galaxy Arriba Sports Shoes,46089,5,APYRY5W5KPXN7,Women
ADIDAS Women White & Grey Vanquish Sports Shoes,24409,4,A11SDECT20DPAB,Women
iPanema Women Black Flip Flops,44188,4,A31OFOZ9GET8AN,Women
Nike Women City Court White Sports Shoe,17841,5,A29FXZIZ598FDM,Women
Rocia Women Silver Heels,54128,5,A3E2GP3Z1EGVQ8,Women
Puma Women Grey Techno Ind Sandals,43957,4,A2AGYTSVLRSV5X,Women
Carlton London Women Four Strapped Gold Sandal,2628,1,A3N2I59UQT85AI,Women
iPanema Women White Flip Flops,49809,4,A1E0IC983BZ9T5,Women
Reebok Women Zig Sonic Yellow and Grey Sports Shoes,4170,2,A3GRZEZMPL515U,Women
Rocia Women Brown Flats,54117,3,A3LEA0HZFBAFVS,Women
Nike Women Capri White Casual Shoes,12702,3,A2CPYXQY7MN36Q,Women
Nike Women Main Draw White Blue Shoe,3167,5,A2EK2CJNJUF7OQ,Women
Nike Women Black Tenkay Shoes,26705,2,AOKIUG9H8I8KU,Women
Catwalk Women Leather Cutshoe Brown Flats,2889,5,A2GWNGQF9SHRE4,Women
Nike Women Sweet Classic High Purple Casual Shoes,15715,1,A2ENHE4BV0AMQ1,Women
Rocia Women Grey Sandals,45401,4,A3I0LI9N8KSNHG,Women
Catwalk Women Gold Flats,27081,2,ABV67T136UXFQ,Women
Nike Women Grey Lunarswift +3 Sports Shoes,22735,3,A2EPPFVDAIDQSI,Women
Enroute Women Pink Flats,35782,1,A1XJSB99WXLB11,Women
Fila Women Top Fuel Black Sports Shoes,34650,1,AC1FTP0718XJ2,Women
Rocia Women Black Wedges,57302,4,A2FGRVS5G82DF3,Women
Catwalk Women Lifestyle White Shoes,11517,1,A2QYQGE34MQ2KX,Women
Catwalk Women Black Heels,27075,4,A1RJZQBN9DC492,Women
iPanema Women Gold Flip Flops,49836,1,A2KI79THZD6NL1,Women
Enroute Women Steelblue Heels,14401,5,A3OIXDNDD9AGD4,Women
Catwalk Women Black Heels,30694,3,A1OCP4Y8GQUQRK,Women
Reebok Women Navy Blue Casual Shoes,43366,4,A10R4813UIW6GH,Women
Catwalk Women Black Heels,46614,4,A3N8V0AOIXAP6N,Women
Catwalk Women Leather Formal Grey Heels,2880,4,A13UY6KF3KLR48,Women
Puma Women's Feuerwerk White Shoe,5897,2,AKW9T9A31BEGB,Women
Rocia Women Beige & Brown Sandals,45408,2,A1HU9QLNJV9ZED,Women
Lotto Women XL Kelly Blue Slippers,19125,4,A2IAHS4CJDTUVO,Women
Catwalk Women Black Heels,2874,5,A1KI7I8NRV3SIQ,Women
Puma Women Grey Axis Sports Shoes,33824,3,AKSKAH1FHICQZ,Women
Enroute Women Casual Beige Flats,14408,4,A3I1T0KEU8YDBY,Women
ADIDAS Women Sweep Green Sandals,34833,1,A3VEAEI9YT0GN6,Women
Puma Women Black Grace Flats,29582,1,A1R4UG6BNDBBOL,Women
Rocia Women Black Flats,54121,4,A2JIQP1H0N7NO5,Women
Portia Women Black Flats,47536,5,AKWRO5WFQ4I85,Women
Rockport Women Jeanie Thong Chain Pink Flats,15511,3,A1ALXIEJWSM3WX,Women
Catwalk Women Casual Brown Heels,21724,3,A10SBRHY5Z8FT3,Women
Nike Women Trainer White Purple Shoe,4146,2,A3K0Q7BLOD5P0X,Women
Catwalk Women Black Heels,53136,3,A3C5QQXTWQQARI,Women
Nike Women Ballista II White Sports Shoes,15723,2,A1E2DD77GZJWS0,Women
Enroute Women Silver Wedges,14437,3,A35DSJ5BVS8H2A,Women
Catwalk Women Multi colour Wedges,46622,1,A3LSRSY3F7CWPA,Women
Inc 5 Women Casual Black Wedges,13044,3,A1EQMKGBI0NK71,Women
Catwalk Women Blue Flats,55651,4,A1DGD9AGZNF6O9,Women
Rocia Women Brown Sandals,34454,2,A29NE7F0K4WO86,Women
Lotto Women White & Pink Blossom Flip Flops,44723,1,A2MQ9OGYO9PFGM,Women
Catwalk Women Casual White Heels,20266,3,AAKT6MS1SVJDT,Women
ADIDAS Women Ranger Navy Blue Sports Shoes,34834,4,A3995A1MLGMSZK,Women
Puma Women Axis Grey Sports Shoes,33823,3,A2NU51KZVY9J9Z,Women
Catwalk Women Bronze Brown Heels,11519,3,A5VR137GUB7JQ,Women
iPanema Women Black Flip Flops,49838,3,A33ZO6NTU56R7F,Women
Carlton London Women Red & Black Heels,59050,1,A1CZJUWPTGMYU1,Women
Rocia Women Brown Flats,54119,3,A1X5WU8A9F3CGU,Women
Catwalk Women Black Ballerinas,2887,2,AV7UMGQ691DK1,Women
