ProductTitle,ProductId,Rating,UserId,Gender
Gini and Jony Girls Knit White Top,42419,5,A39HTATAQ9V7YF,Girls
Gini and Jony Girls Black Top,34009,2,A3JM6GV9MNOF9X,Girls
Gini and Jony Girls Pretty Blossom Blue Top,40143,4,A1Z513UWSAAO0F,Girls
Doodle Kids Girls Pink I love Shopping Top,23623,3,A1WMRR494NWEWV,Girls
Gini and Jony Girls Black Capris,47154,4,A3IAAVS479H7M7,Girls
Doodle Kids Girls City Chic White Top,25520,2,AKJHHD5VEH7VG,Girls
Palm Tree Girls Pink Top,31120,2,A1BG8QW55XHN6U,Girls
Gini and Jony Girls Red Top,31118,5,A22VW0P4VZHDE3,Girls
Do u speak Green Girls Olive 3/4 Pant,54923,1,A3V3RE4132GKRO,Girls
Gini and Jony Girls Black Dress,31127,4,A327B0I7CYTEJC,Girls
Gini and Jony Girls Pink Capris,47153,2,AIFAAVTUYHEHB,Girls
Gini and Jony Girls Pretty Blossom Pink Top,40144,2,AVOGV98AYOFG2,Girls
Doodle Kids Girls White I love Shopping Top,23624,4,A6R426V4J7AOM,Girls
Allen Solly Kids Girls Poplin Pink Shorts,34693,3,AKGB62WGF35J8,Girls
Disney Kids Girl's Summer Fun Fair Yellow Teen Kidswear,4718,3,A3A4C2K3TWDAO5,Girls
Little Miss Girls Chatterbox Navy Blue Dress,36750,4,A3FV2Q7WPZMQPV,Girls
Gini and Jony Girls Pink Top,34007,5,A1RXI3A1E99112,Girls
Giny and Jony Girls Printed White & Pink Dress,31129,1,A26QL1FBQO9C0E,Girls
Disney Kids Girl's Fun In The Fair Yellow Teen Kidswear,4720,5,A19KEEVZYO1KO6,Girls
Doodle Cute Girls  Grey Tshirt,17612,2,A1F6HRR58TQ2R0,Girls
Doodle Girls Blue Printed Dress,50723,5,AVQP6PO1NK0IJ,Girls
Gini and Jony Girls Red Skirt,33271,3,A32IWHU4TUEQZR,Girls
Gini and Jony Girls Woven Navy Blue Shorts,41007,3,ASPJCWRXUOYYY,Girls
Gini and Jony Girls Pink Skirt,46813,2,A1LAW520BT5AM0,Girls
Gini and Jony Girls Woven Blue Shorts,41000,4,A3SWQ2QQ7JBPFA,Girls
Doodle Girl's Princess Lime Kidswear,8378,5,A2D7CPCZH5VFVZ,Girls
Gini and Jony Girls Green Shorts,39328,4,A274NIJWOQWE30,Girls
Doodle Girls Blue Washed Dress,50724,2,A2OMU0R0VM5O9I,Girls
Gini and Jony Girls Pink Skirt,46814,3,A2YFDS6DYGFLVQ,Girls
United Colors of Benetton Kids Girls Washed Blue Skirt,29171,2,AKA7T9TPISJ26,Girls
Gini and Jony Girls Black Dress,34065,1,AN33X95J5460X,Girls
Gini and Jony Girls Printed White Top,31173,1,A2UEOW698J0SSR,Girls
Doodle Girls Printed Grey Top,34091,1,A22ZFXQE8AWPEP,Girls
Doodle Girl's Dont Worry Hippie Yellow Teen Kidswear,8371,5,A9ZNJ2AXPO652,Girls
Gini and Jony Girls Blue Capris,39321,1,A169NC0ZW6XKRD,Girls
Gini and Jony Girls Woven Navy Blue Jeans,41009,5,AZWRTJPN7NXT,Girls
Doodle Girl's Hippie Chic Orange Teen Kidswear,8385,1,AH344ZAN5GNOM,Girls
Madagascar3 Girls Purple Printed T-Shirt,37613,5,A1YQUT1H2ENJ8U,Girls
Gini and Jony Kids Leggings,31180,5,A3C744AK5A6MMI,Girls
Gini and Jony Girls Red Top,31174,2,A2H6SFTV2892Z8,Girls
Gini and Jony Girls Printed Pink Dress,34062,3,A225CH9TTQPC4B,Girls
Gini and Jony Girls Roseatte Orange Top,40128,4,A2F6NPTGDMFXN9,Girls
Doodle Girl's Raw Edges Light Blue Kidswear,8382,1,A1DC0DSF3H3BCW,Girls
Gini and Jony Girls Black Leggings,39326,1,A3TR91FJ4MNFY9,Girls
Gini and Jony Girls Printed Teal Dress,31128,4,A3IANSH41YHFP1,Girls
Gini and Jony Girls White Top,31117,5,A2NRG4NQMLHDJQ,Girls
Disney Kids Girl's Fun In The Fair White Teen Kidswear,4719,4,A32G79IU2NJ2HS,Girls
Kids Ville Girls Turquoise Blue Top,38290,4,A3L2VTHD6W1E2Z,Girls
Little Miss Girls Blah White Top,36751,4,A15THVWZS6GQZY,Girls
Gini and Jony Girls Purple Top,34006,2,A1VCW66KPTNUV8,Girls
Gini and Jony Girls Nautical Blues Navy Blue Top,40946,1,AO5JB67V93FBL,Girls
Gini and Jony Girls Purple Top,31119,1,A1GWD6BDCLGC82,Girls
Gini and Jony Girls Kinky Pink Capris,40145,5,AJ85OD05LNNUY,Girls
Doodle Kids Girls Pink Retro Top,23625,5,A1E5CS6UI1LWQF,Girls
Gini and Jony Girls White Dress,31126,1,A1SWCNGOR3GMOQ,Girls
Gini and Jony Girls Pink Top,34008,1,A2IOZRH02O4C9S,Girls
Gini and Jony Girls Pretty Pink Top,40941,1,A1RGXKJ4RFIOCX,Girls
Gini and Jony Girls Woven White Top,42418,5,A11OEJ4R1PDTLN,Girls
Gini and Jony Girls Black Top,31121,3,AZ4FR14IPKML7,Girls
Disney Kids Girl's Summer Fun Fair Pink Teen Kidswear,4717,5,A251DS38L87XWF,Girls
Gini and Jony Girls Purple Top,31175,4,A1Z03R982SX8V2,Girls
Gini and Jony Girls Printed Pink Dress,34063,3,A1ZY0K46FYOTB6,Girls
Gini Jony Girls Printed White Top,39743,2,A3MAATZ091QZGE,Girls
Gini and Jony Girls Green Leggings,39327,3,A35XCJ5P6ZKRE9,Girls
Doodle Girl's Raw Edges Light Blue Teen Kidswear,8383,5,A2B3YKKXVN28TW,Girls
Disney Kids Girl's Pooh Denim Blue Skirt,3901,5,A2RDR51FRB58LD,Girls
Gini and Jony Girls Printed Teal Dress,34064,4,A2MSCG0YX85RL4,Girls
Gini and Jony Girls Peach Top,31172,3,A2P8AUMTM6O605,Girls
Doodle Girls Printed Pink Dress,27225,5,A3SN6TKIXQI7RP,Girls
Doodle Girl's Hippie Chic Orange Kidswear,8384,3,A1MLJHYS35C4X6,Girls
Gini and Jony Girls Woven Navy Blue Jeans,41008,3,A2FTLN4PYZE7S6,Girls
Gini Jony Girls Printed White Top,39744,5,ATPHIBSTV1NY5,Girls
Gini and Jony Girls Polo Striped Blue T-shirt,43590,2,A1QWS6V26JZ5OX,Girls
Gini and Jony Girls Roseatte Black Dress,40127,2,A1VK4ALI1QOF5U,Girls
Doodle Girl's Princess Lime Green Top,8379,3,A1GIXQUBPA0DPT,Girls
Gini and Jony Girls Green Shorts,39329,2,A22L53OZ7IDQX3,Girls
Gini and Jony  Girls Woven Blue Shorts,41001,5,AAOU507M8SF9E,Girls
Gini and Jony Girls Yellow Top,46815,2,A2DIOCFQZQFD9O,Girls
Gini & Jony Girls White Skirt,33270,4,A17Z7DO3IFHZOE,Girls
Doodle Girls Pink Printed Dress,50722,4,A120LZ9VNR3YI0,Girls
Gini and Jony Girls Woven Navy Blue Shorts,41006,2,A39QH03VD9U048,Girls
Doodle Girls's Princess Purple Teen Top,8465,5,A95YCV8FK2LCM,Girls
Doodle Girls Washed Black Shorts,34118,4,AP57TEKK91CIM,Girls
Madagascar3 Pink Girls Innerwear Vest,37564,4,A3OQ3FVYBU7SBD,Girls
Ant Kids Girls Butterfly Print White Dresses,12849,2,A2GDJP70RVLDKY,Girls
Gini and Jony Girls Printed Blue Top,39852,5,A2BQ8DVGEGWAFY,Girls
Madagascar Girls Pink Innerwear Vest,37590,3,A2A0EW34FZH9Z7,Girls
Mr. Men Little Miss Girls White Top,38342,1,A1D6UAVLQUS41B,Girls
Gini And Jony Girls Striped Green Top,36213,4,A2VRUBSVHDDOU9,Girls
Madagascar3 Infant Boys White Snapsuit Romper,37563,5,A276N142RFK6EF,Girls
United Colors of Benetton Kids Girls Pink Top,24941,2,A2HNQ3JHXDSVMW,Girls
Disney Kids Girl's Dress Pink Pooh Kidswear,2707,3,ADURH4ZDRMZV6,Girls
Doodle Girls Washed Blue Capris,34116,5,AXVLSEEYTC4Z9,Girls
Gini and Jony Girls Printed White Top,38945,4,AGGXC77INUISD,Girls
Chhota Bheem Kids Girls Are You Game Pink Top,21868,3,A10REFE1TW3ZVT,Girls
United Colors of Benetton Kids Girls White Printed Top,24946,5,A3M7ROZKQW6F69,Girls
Doodle Girls Yellow Dress,27196,1,A271KYL82709TY,Girls
Doodle Girls Striped Navy Blue Top,34111,3,A1OON4OPP58E26,Girls
Doodle Girls Blue Printed Dress,52131,2,A3COLQK8Y9V9A5,Girls
Disney Kids Girl's White Kidswear,2700,4,A28H0PAQPYKN94,Girls
Gini and Jony Girls Printed Green Top,33152,5,AYI1LDJYGG0ZK,Girls
Gini and Jony Girls Core Purple Shorts,39830,1,A3T5EYVSBN3QQX,Girls
Hannah Montana Girls Blue Top,38327,5,A3E4N6O6WC8LEX,Girls
Disney Kids Girl's Minnie Summer Time White Top,3820,3,A30IURTQM5NNA4,Girls
Doodle Kids Girls Ballon Green Top,18171,3,A100GYE1W4OXZ8,Girls
United Colors of Benetton Girls White Printed T-Shirt,42590,4,A1ZWS1H6H06Y2J,Girls
Hannah Montana Girls Off White Tops,38329,4,A3BMQUL5QATQIW,Girls
Doodle Girls Washed Blue Shorts,35436,4,AI5JNFT6YBQQY,Girls
Doodle Kids Girls Black Layer Top,18178,4,A2H79ANDK766S1,Girls
Doodle Girls Printed Blue Top,43683,4,A3LO1A9N0F0TXE,Girls
Gini and Jony Girls Fixed Weast Pink Capris,41312,3,A2JYNUBR7H2W41,Girls
Gini and Jony Girls Nautical Blues Navy Blue Top,39005,2,A2O9UKJ2FR0GZ4,Girls
United Colors of Benetton Kids Girls Red Printed Top,24947,1,A1O5Z4ZKPMHORQ,Girls
Doodle Girls Blue Printed Dress,52130,4,A366PG2T9L9VSW,Girls
Doodle Girls Printed Red Top,34110,1,A11AT6B3912DCU,Girls
Gini and Jony Girls Pink Top,43042,4,A2RCLQ2PS3PN8H,Girls
Disney Kids Girl's Yellow Daisy Kidswear,2701,5,A445U3NN5XBYK,Girls
Gini and Jony Girls Printed White Top,38944,4,A3GAMJUEB4A4J9,Girls
Disney Kids Girl's Pink Pooh Kidswear,2706,2,A7BCFTL2PU1NZ,Girls
Doodle Girls Washed Blue Shorts,34117,2,A87X19PQJFYFA,Girls
Mr. Men Little Miss Girls White Tops,38343,5,A2F5SHIP4HF9,Girls
Gini and Jony Girls Summer Up Blue Top,41971,1,A305WEYT5UZKCZ,Girls
Madagascar3 Infant Boys Light Green Snapsuit Romper,37562,3,A2E8U0H25VGG3O,Girls
Gini and Jony Girls Navy Blue Capris,46733,1,A2S1HDSZ0OGW1M,Girls
Disney Kids Girl's Red Round Neck Kidswear,2730,3,AFRE5F3MKUKME,Girls
Gini Jony Girls Black Top,36212,2,A11Q1HQ84F8POH,Girls
United Colors of Benetton Kids Girls Pink Printed Top,24985,4,A2CCV112TWLK7A,Girls
Gini and Jony Girls White Pedal Pusher,41976,3,A2099WPFJKJKZC,Girls
Disney Kids Girl's White Dress Pooh Kidswear,2708,3,A1T8YQ4FFMWQPC,Girls
Disney Kids Girl's Red Kidswear,2737,1,AZLE2XFH3JUNG,Girls
Gini and Jony Girls Core Purple Shorts,36215,3,A99JEK1Z8S1T0,Girls
Madagascar Girls Green Innerwear Vest,37565,2,A2OCBW6UQ8GS7L,Girls
Hannah Montana Girls Pink Top,38328,3,AI6IXAB24N30W,Girls
Doodle Girls Washed Black Shorts,35437,1,A2GPHFP5QKF0CO,Girls
Doodle Kids Girls Black Layer Top,18179,3,A2ZZ26N7K9BSFB,Girls
Fabindia Girls Printed Pink Lehenga Choli,30725,3,A1MID7V80H36FX,Girls
Gini and Jony Girls Printed Peach Top,39836,4,A10ZKDOZOSH219,Girls
Gini and Jony Girls Printed White Top,33153,4,A1CNSLLYW5A8YB,Girls
Gini and Jony Girls Core Magenta Shorts,39831,1,ARUSOE3CJ7TNF,Girls
Ant Kids Girl's Sleeveless With Flower Print Kidswear,5570,3,A2Z9QP4MZ2HXCZ,Girls
Disney Kids Girl's Minnie Summer Time Pink Top,3819,1,ACZ94JB8BFMJ9,Girls
Hannah Montana Girls Pink Printed Top,38326,5,A36ZKFLSDE8WX5,Girls
Gini and Jony Girls Printed White Top,34159,1,AVCSVH9L0BPIF,Girls
Gini and Jony Girls Kitch Peachy Pink Top,39010,3,A2VF4TALLW8G9,Girls
Gini and Jony Girls Black Top,41307,3,A3UFMKLD77O21S,Girls
Gini and Jony Girls Purple Top,34166,5,A1QPQIJVS0JC5Y,Girls
Gini and Jony Girls Black Leggings,38935,5,A2UQZD76FKVQ6D,Girls
Gini and Jony Girls Pink Shorts,38767,3,A1LNS0V7YBBJJE,Girls
Gini and Jony Girls Pink Leggings,33149,3,A3B0M39TDARC6X,Girls
Gini and Jony Girls Pink Leggings,38932,3,A1ZNOA9OHWIVMH,Girls
Doodle Girls Printed Yellow Top,43691,5,A15ELVI3I6G1SQ,Girls
Gini and Jony Girls Black Top,34161,1,A35ELDPD0N7T0U,Girls
Gini and Jony Girls Polo Striped Blue T-shirt,41300,3,A1B07LXV78TWZ,Girls
Mr. Men Little Miss Girls Red Printed Top,38335,5,A29LZJWIY7KJZR,Girls
Doodle Girl's Hippie Chic White Teen Kidswear,8415,3,A13IIHXY0QX4Y4,Girls
Gini and Jony Girls Woven Peach Top,41309,2,A1AM400PUH70WO,Girls
Fabindia Girls Printed Magenta Salwar,30731,5,A18X2IP46I5JB8,Girls
Disney Kids Girl's Pink Summer Fun Fair Kidswear,4213,3,A2DT0SAXS5DIL8,Girls
Gini and Jony Girls Peach Top,34157,5,A29AQSCFQ1OZ9R,Girls
Gini and Jony Girls Knit White Top,45568,4,A225BCNNIG03JT,Girls
Hannah Montana Girls Pink Top,38332,4,A3590W7FEAGQY4,Girls
Gini and Jony Girls Blue Jeans,33147,5,A1U6E8IJEATCYM,Girls
Doodle Girls Printed Blue Top,41755,3,A1X1X91COEBHVI,Girls
Disney Kids Girl's Pink Kidswear,2741,4,A2RNK4TW1FPXEF,Girls
Disney Kids Girl's Yellow Summer Fun Fair Kidswear,4214,5,AYHZNXRPOHMO2,Girls
Gini and Jony Girls Printed Blue T-shirt,38769,3,A3NIHH9X6L3RRM,Girls
Doodle Girls Orange Printed Dress,52124,3,A1UDWB8WFFGN55,Girls
Disney Kids Girl's Minnie Orange Stripped Kidswear,2715,4,A20LFHVP5CMQ1,Girls
Doodle Girls Printed Peach Top,35446,5,A16495HOSCEV0N,Girls
Disney Kids Girl's Pink Minnie Top With Green Bow Kidswear,3892,2,A22ET3HEUN5JNP,Girls
Doodle Girls Printed Peach Top,35441,3,A1NNJ0MNFIF3Z8,Girls
Gini and Jony Girls Pretty Blossom Blue Top,41998,5,A2C55XULIQ3F8I,Girls
Palm Tree Girls White Top,38950,2,AOJRTF5PJMIR6,Girls
Disney Kids Girl's Halter Neck Blue Kidswear,2712,1,ACUB5EB5F72B9,Girls
Doodle Girls Pink Printed Dress,52123,2,A1XD9BN1CBR8U4,Girls
Disney Kids Girl's White Minnie With Pink Lace Kidswear,3895,3,A2K18LH5HC6K9B,Girls
Gini and Jony Girls Striped Blue Top,39849,3,A38JQUXZTKKHQP,Girls
Madagascar 3 Infant Girls White Booties,37576,3,A1QMSSMUBUXX5S,Girls
Madagascar3 Girls White Shorts,37582,1,A3VUS3HC1CCVOQ,Girls
Gini and Jony Woven Navy Blue Jeans,38501,4,A19VNE2EF1QYNE,Girls
Madagascar 3 Infants Girls Pink Booties,37549,5,A1L8MP88Q3DXXJ,Girls
Doodle Girls Printed Red Top,35448,5,AEPAHTOT8YT04,Girls
Gini and Jony Girls Printed Pink Top,39847,4,AM0RSD59GI2IK,Girls
Madagascar3 Infant Girls White Snapsuit Romper,37585,4,A2XYBHUJ7E1QDR,Girls
Madagascar3 Infant Girls Light Green Spaghetti Top,37571,3,A39GFZUNMWJ44J,Girls
Gini and Jony Girls Roseatte Black Dress,41996,2,AEWKMTITVR260,Girls
Gini and Jony Girls Woven Pink Pedal Pusher,38506,1,A1C4OJZCDI8LN3,Girls
Hannah Montana Girls Yellow Printed Tops,38333,3,ACZBT8YQ2TYOY,Girls
Gini and Jony Girls Printed Blue T-shirt,38768,2,A24662VRPFY4YK,Girls
Disney Kids Girl's White Fun In The Fair Kidswear,4215,5,A3S87ZOPB3UM9N,Girls
Disney Kids Girl's Blue Kidswear,2740,5,A18CAHNYYC8AA3,Girls
Doodle Girl's Hippie Chic White Kidswear,8414,1,AGXDI4U7PAUGZ,Girls
Mr. Men Little Miss Girls White Printed Top,38334,2,ADZZCC6UUMA0N,Girls
Gini and Jony Girls Peach Top,34156,2,A1F4CQTUN5WTEA,Girls
Fabindia Girls Printed Purple Salwar,30730,4,AQFATFCB1HBG3,Girls
Disney Kids Girl's Yellow Kidswear,4212,5,ASPRENFTOYHO0,Girls
Allen Solly Kids Girls Poplin Pink Shorts,38905,5,A2DOQ89OLXNHNL,Girls
Gini and Jony Girls Black Leggings,33148,1,A1IFYKTMBOTBP7,Girls
Gini and Jony Girls Pink Shorts,38766,3,A364UC5PLUM8M3,Girls
Gini and Jony Grils Polo Striped Pink T-shirt,41301,2,AC4343QXC1BCQ,Girls
Gini and Jony Girls Pink Leggings,38933,2,A7SVI5Q1WC3UP,Girls
ANT Kids Girls Solid White Short,16806,2,A28UWG41MHTXGC,Girls
Gini and Jony Girls Printed White Top,34158,4,A2EH8T3LQS6EET,Girls
Gini and Jony Girls Happy Style Blue Leggings,39011,1,A1HBQHOWMXOLBM,Girls
Gini and Jony Girls Black Leggings,38934,3,A1MOOCFYF4BW9F,Girls
Gini and Jony Girls White Dress,34167,2,A31J5P90FNANXZ,Girls
Madagascar3 Infant Girls Pink Spaghetti Top,37570,2,A34LP4FWKYTHB5,Girls
Gini And Jony Girls Striped Green Top,39846,3,A328DC9RTOA5WS,Girls
Madagascar3 Infant Girls Light Green Snapsuit Romper,37584,1,A8R89360S6RZ3,Girls
Gini and Jony Girls Pretty Blossom Blue Top,41997,1,A1B9XPHEGQ986Y,Girls
Disney Kids Girl's Minnie Heart Pink Kidswear,3851,4,ABKY0V59DOJ5Y,Girls
Gini and Jony Girls Core Green Top,41963,2,A3DHGDJ779MMSD,Girls
Madagascar3 Infant Girls Pink Snapsuit Romper,37583,4,AH9GYBKL6KJOF,Girls
Gini and Jony Girls Striped Pink Top,39841,2,A2Z1MC0VM2SCZ7,Girls
Gini Jony Girls Printed White Top,36207,3,AWL41OE56O3O3,Girls
Gini and Jony Girls Woven Black Jeans,38500,5,A3AOPVHGVIEHFK,Girls
Doodle Girls Striped Navy Blue Top,35449,4,A1G8D0R2YLCJPR,Girls
Gini and Jony Girls Pretty Blossom Pink Top,41999,4,A1E5TTW0XXZIE7,Girls
Disney Kids Girl's Pink Minnie With Green Lace Kidswear,3894,5,AV434O5MUBGN5,Girls
Doodle Girls Printed Red Top,35447,1,A1CT0SH9XKNIDY,Girls
Doodle Girls Pink Printed Dress,52125,3,A1FGEAEGWVYJ2I,Girls
Disney Kids Girl's Green Minnie Top With Pink Bow Kidswear,3893,3,A2WDW3VRWKRRWV,Girls
Disney Kids Girl's Pink White Sweet Hunny Pack of 2 Kidswear,5215,1,A86RECWKC0IKS,Girls
Gini and Jony Girls Elasticated Black Capris,42003,3,A2GMXV65XFTCR6,Girls
Doodle Girls Little song board Purple Tops,10672,4,A2TSBFY4ZZIMXW,Girls
Gini and Jony Girls Woven White Top,43579,4,AGQ844D0UXGBF,Girls
Doodle Girl's Happy Smiles Blue Pink Kidswear,8364,3,A3E13GVY40E6T5,Girls
Gini and Jony Girls Elasticated Black Capris,42004,1,A1E09RWAID7HCH,Girls
Gini and Jony Girls Printed Blue Top,36727,4,A2ME4DLS0Q488W,Girls
Ant Kids Girl's Check Top Black Kidswear,5444,4,A2HZV40RNSZ381,Girls
Gini and Jony Girls Happy Style Blue Leggings,40930,5,AS498SIPUF2PU,Girls
Madagascar3 Girls Coral Printed T-Shirt,37608,3,AL4XKV2S6IXQS,Girls
Madagascar3 Girls Teal Printed T-Shirt,37637,5,A138ATFNJU102C,Girls
Gini and Jony Girls Pink Top,43584,2,A1B0Q1X54GILZP,Girls
Gini and Jony Girls White Dress,31168,4,A22HDI6Y0ERZLN,Girls
Gini and Jony Girls Printed Pink Top,36729,3,A3SK4E6TWXE367,Girls
Gini and Jony Girls Milan White Top,38481,2,A3CHPIP8HRFNC8,Girls
Doodle Girls White and Purple Printed Top,57980,3,A1GIGGY4X47QMA,Girls
Gini and Jony Girls Woven Peach Top,43577,3,A3V6ZQWSMLRXEJ,Girls
Madagascar3 Girls Soft Red Printed T-Shirt,37630,4,A38L32Q21P5T95,Girls
Gini and Jony Girls Pink Dress,34015,4,A3BWP3PY4IUMTH,Girls
Doodle Kids Girls Polka Dot Black Dress,25503,2,A1NRLEB0KOB65O,Girls
Gini and Jony  Girls Woven Black Jeans,40997,3,A3UQXZCB1CXFNL,Girls
Palm Tree Girls Printed White Top,34012,4,A3T58OUIBEL24K,Girls
Little Miss Girls Sunshine Red Clothing Set,36745,5,A3AAAZ446W2B3B,Girls
Gini and Jony Girls Summer Up Blue Top,40158,3,A3ILSW0GC00YY,Girls
Palm Tree Girls Milan White Top,40990,3,AJ8114KFKVCHX,Girls
Gini and Jony Girls Woven Black Jeans,40999,3,ANLSZ40VRRB21,Girls
Doodle Girls Raindrops White Tshirts,17609,3,A2U1PYP2Q7BUB2,Girls
Ant Kids Girls Blue T-shirt,5417,4,A024581134CV80ZBLIZTZ,Girls
Gini and Jony Girls Core Green Top,40156,3,ABLW2M2R7VQIA,Girls
Ant Kids Girl's White Free Bird Kidswear,5428,2,A294IJJRMVOBSE,Girls
United Colors of Benetton Girls Blue Jeans,37209,4,A3FPJWX0GHJCCG,Girls
Gini and Jony Girls Printed Peach Top,36728,1,A5UQ98GXX7T47,Girls
Gini and Jony Girls Knits White Top,43576,1,A13G2YWZQ3522K,Girls
Gini and Jony Girls Happy Style Blue Leggings,40931,4,A1Q3W2FX8LKH19,Girls
Madagascar3 Girls Soft Red Printed T-Shirt,37636,2,A13UXDADSBZ0NV,Girls
Gini and Jony Girls Pink Top,43585,5,AY25UTTDNJ5SX,Girls
Gini and Jony Girls Woven Peach Top,43578,2,A2W470AYOQCZZ9,Girls
Doodle Girl's Happy Smiles Pink Kidswear,8365,2,A95LEWENLGMHH,Girls
Gini and Jony Girls Blue Dress,31167,3,A30HUW0YSPL6N,Girls
Gini and Jony Girls Nautical Blues Magenta Top,40938,1,A9E7CTWB6KFTK,Girls
Gini and Jony Girls Kinky Pink Capris,42002,3,A3MNCA0VED4SQD,Girls
Madagascar3 Girls Sea Green Printed T-Shirt,37607,4,A1GLIRME0V0J4Z,Girls
Gini and Jony Girls Printed White Top,31160,3,A20BE32WVZFXAF,Girls
Ant Kids Girl's White Little Heart Kidswear,5416,4,AYFZQPNEVSFMD,Girls
Gini and Jony Girls Pink Skirt,42290,2,A3FNVF412991A6,Girls
Palm Tree Girls Woven Black Jeans,40998,5,A37KZTDCHTQMU0,Girls
Gini and Jony Girls Printed White Top,34013,2,A3TDS7PK6K3TY1,Girls
Little Miss Girls Naughty Pink Top,36744,4,A3UX3UDVQ9OHLI,Girls
Kids Ville Girls Pink Printed Top,38285,4,ABVND860D55AJ,Girls
Ant Kids Girl's Pink Free Bird Kidswear,5418,1,A26TLFFBFPEOKJ,Girls
Gini and Jony Girls Milan Yellow Top,40991,2,A2Q8QWVIZM213M,Girls
Gini and Jony Girls Pink Top,40159,3,A3C5DYTUXUCL0S,Girls
United Colors of Benetton Girls Washed Blue Jeans,37201,3,A3DNSZT2HIB30J,Girls
Gini and Jony Girls White Pedal Pusher,40161,5,AA0ACUPEPT1RN,Girls
Gini and Jony Girls Printed White Top,34014,1,A16UTJN8DODY6N,Girls
Little Miss Girls Chatterbox Pink Top,36743,3,ACB9GSMY2GY0O,Girls
Gini and Jony Girls Woven Pink Pedal Pusher,40996,5,ANNS6DSY390Z2,Girls
Gini and Jony Girls Woven Blue Skirt,41003,1,A39SBRLJ1EQX1R,Girls
Gini and Jony Girls Polo Striped Pink T-shirt,43592,1,A3A2HRW0GR4EWU,Girls
Gini and Jony Girls Red Skirt,39314,2,A2H3NOCLLEPOKQ,Girls
United Colors of Benetton Kids Girls Printed Pink Skirt,29172,4,A1JM3NL9GSQ17N,Girls
Madagascar3 Girls Pink Printed T-Shirt,37626,1,A2P0254ZZ42ZOJ,Girls
Gini & Jony Girls Pink Pedal Pusher,33272,3,A2686J58T322ZS,Girls
Doodle Girls Orange Printed Dress,50720,5,A7DS7JE3D53XW,Girls
Gini and Jony Girls Woven Navy Blue Skirts,41004,1,A267CAHUU3HOPQ,Girls
Gini and Jony Kids Girls Black Capris,41236,1,A30CAUEGZO0DO6,Girls
Madagascar3 Girls Pink Printed T-Shirt,37610,4,A249F9ZBJ3ZDIA,Girls
Doodle Girls Printed Multi Coloured Dress,34095,2,A9AZG7UY7VT89,Girls
Gini and Jony Girls Red Top,31177,5,A05492663T95KW63BR75K,Girls
Gini and Jony Girls Printed White & Pink Dress,34061,5,A2LRQ8GV6PZMHX,Girls
Doodle Girl's Raw Edges Purple Teen Kidswear,8381,1,A2B3FQVNDDT4PF,Girls
Disney Kids Girl's Minnie And Daisy Yellow Kidswear,3903,5,A1YJEY40YUW4SE,Girls
Doodle Girl's Dont Worry Hippie Blue Teen Kidswear,8375,4,AS5RB0XRDQZCS,Girls
Gini and Jony Girls Printed Yellow Top,39325,5,A6SS3B6BFQ5KX,Girls
Gini and Jony Girls Striped Pink Top,36731,1,A293VWKAL1RWBG,Girls
Palm Tree Girls White Dress,34066,4,ABPIQZ23IBOJ,Girls
Doodle Girls Printed Off White Top,34092,5,A2DQ8W8ON2QZD3,Girls
Doodle Girl's Dont Worry Hippie Teal Blue Kidswear,8372,3,A18S7SDS6HJ4LA,Girls
Gini and Jony Girls Blue Capris,39322,4,A60XNB876KYML,Girls
Gini Jony Girls Black Top,39746,2,A2U7D909NH8L0U,Girls
Madagascar3 Girls Off White Printed T-Shirt,37628,2,A3G6XNM240RMWA,Girls
Disney Kids Girl's Red And White Minnie Flower Kidswear,3904,1,A00205921JHJK5X9LNP42,Girls
Gini and Jony Girls Kitch Bright Pink Top,40944,3,A1SXKLV75ZL6DM,Girls
Gini and Jony Girls Pink Dress,31124,3,A3CI83124O6ZP1,Girls
Gini and Jony Girls Blue Pedal Pusher,40147,3,AYM7E80UCJX7I,Girls
Doodle Girls Red Leggings,17620,2,AIPOM0VDQ2SN3,Girls
Gini and Jony Girls Kitch Bright Pink Top,40943,4,A1QY7B8PEZDTDZ,Girls
Doodle Girls Lace Bow Black Leggings,17618,1,A187IEMZIHO4UU,Girls
Gini and Jony Girls Printed White Top,31123,3,A4R3YZHWJSWHU,Girls
Gini and Jony Girls Play Suit Pink Dress,40149,2,AO4WIKXQZJDQE,Girls
Disney Kids Girl's Jeans Blue Teen Kidswear,4723,2,A1R3PGXKL7EZSJ,Girls
Little Miss Girls Blazing White Top,36754,4,A1PQFP6SAJ6D80,Girls
Gini and Jony Girls White Top,34003,2,A38FVHZTNQ271F,Girls
Allen Solly Kids Girls Mock Layered Grey Top,38868,5,A11PBM6FRXUJ5Q,Girls
Palm Tree Girls Knits White Tops,40972,2,A1GX3Y7VXYG6TH,Girls
Disney Kids Girls Navy Stripes Mickey Kidswear,4186,4,A3S0E0QE8XYMAK,Girls
Little Miss Girls Chatterbox Blue Clothing Set,36753,1,A2FHYMW4OA53N1,Girls
Gini and Jony Girls White Top,34004,5,AFY6ZIQXMLGR3,Girls
Disney Kids Girl's Yellow Teen Kidswear,4724,3,A3BTN14HIZET6Z,Girls
Gini and Jony Girls Striped Blue Top,36730,3,A2T0H00MMGU7LZ,Girls
Madagascar3 Girls Blue Printed T-Shirt,37629,4,A1Z59RFKN0M5QL,Girls
Gini and Jony Girls Blue Shorts,39323,1,AWUO9P6PL1SY8,Girls
Gini and Jony Girls White Top,31176,5,A6P7VX90EVIKI,Girls
Madagascar3 Girls Blue Printed T-Shirt,37611,2,A1CWY4G16721R2,Girls
Doodle Girls Printed Lime Green Top,34094,4,A1X2OY7Y2J6LO1,Girls
Gini and Jony Girls Blue Shorts,39324,1,A2KF5WHTOADF85,Girls
Doodle Girls Purple Printed Top,8380,2,A1SNMU6VFTJKQI,Girls
Disney Kids Girl's Minnie And Daisy Pink Kidswear,3902,4,A25K4CSIYN1OLB,Girls
Doodle Girls Pink Printed Dress,50721,4,A2EUU17DUVWII9,Girls
Gini and Jony Girls Green Leggings,33273,4,A2D0IC8KRJHG3F,Girls
Gini and Jony Girls Woven Navy Blue Skirts,41005,3,A1S8PWBOOL44SM,Girls
Madagascar3 Girls Purple Printed T-Shirt,37627,5,A27M7DNCKQ6D5Y,Girls
Gini and Jony Girls Polo Striped Pink T-shirt,43593,3,A3MUOZ4MPR1EA6,Girls
Gini and Jony Girls Woven Blue Skirt,41002,3,AAYYLJOCG88F4,Girls
Gini and Jony Girls Black Leggings,33274,3,A37JSWUOEQC89O,Girls
United Colors of Benetton Kids Girls Printed Green Skirt,29173,5,A3GVNPYMG6ON95,Girls
Doodle Girls Red Printed Top,50719,3,AW4GGNNHDM937,Girls
Gini and Jony Girls Black Top,31178,3,AR9GA6ULUK1AC,Girls
Gini and Jony Girls Yellow Top,46816,1,A2JB80MHMU6O3I,Girls
Little Miss Girls Blazing Yellow Clothing Set,36752,1,A2NOM3LJVRKWTJ,Girls
Disney Kids Girls Red Stripes Mickey Kidswear,4187,2,A1L7J1U5Y2RECB,Girls
Palm Tree Girls Purple Top,34005,3,AN0CUE13AJLEW,Girls
Gini and Jony Girls Play Suit Blue Dress,40148,3,A1PZ2ORQU247JZ,Girls
Disney Kids Girl's Jeans Purple Teen Kidswear,4722,4,A1BXLQFDJII0ZE,Girls
Doodle Girls Lace Bow White Leggings,17619,5,AAIGQYAH5WNSU,Girls
Gini and Jony Girls Milan White Top,40989,3,A57JZDRIKHEMC,Girls
Gini and Jony Girls Printed White Top,31122,5,A22PDHKTMOUKKS,Girls
Doodle Kids Girls Navy Blue Floral Print Dress,23621,1,A33A728PP859Y5,Girls
Gini and Jony Girls Nautical Blues Navy Blue Top,40945,4,A1JBLH8S6DLCL1,Girls
Gini and Jony Girls Pink Top,41299,2,AK7O6VOOXQBYQ,Girls
Ant Kids Girl's Humming Birds Blue Kidswear,5438,3,A3I6P2NU6726XG,Girls
Doodle Girls Lace Bow LT.Pink Leggings,17621,1,A25GW5G5GQVKB0,Girls
Gini and Jony Kids Girls Black Capris,47151,2,A1LL4WRN7OBRW8,Girls
Gini and Jony Girls Elasticated Black Capris,40146,5,AOJ5TYNLD4G68,Girls
Palm Tree Girls Printed Peach Top,31125,2,A17U6P3YQISHYH,Girls
Ant Kids Girl's Green Kidswear,5575,3,A4GKGUD4TIFL,Girls
Doodle Girls Printed White Top,41744,1,A7O67Z6ZAYN8B,Girls
United Colors of Benetton Kids Girls Navy Blue Dress,24929,3,A2VHK6MXXTR6FD,Girls
Fabindia Girls Green Mangalgiri Salwar,30727,1,AXG1D956QCMHI,Girls
Ant Kids Girl's Flower Print Frill Pink Kidswear,5581,2,ATWTNXM6WNV5N,Girls
Doodle Kids Girls Magenta Layer Top,18172,4,A32O109KR1IFX7,Girls
Ant Kids Girl's Tiger Print Kidswear,5586,1,A1BW4LQY9U32PC,Girls
Gini and Jony Girls Printed Pink Top,33151,1,A8FPPXG1OEZ77,Girls
Allen Solly Kids Girls Polka Green T-shirt,34710,4,A37E33Y5A3RFYG,Girls
Doodle Kids Girls Party Frock Lavender Dress,18175,1,A3KJ9MA7I7S4IC,Girls
Doodle Girls Printed Pink Dress,35432,2,A4ZAYGW831ZGI,Girls
Gini and Jony Girls Fixed Weast White Capris,41311,4,A2AYT9K7UK7R68,Girls
Fabindia Girls Printed Blue Salwar,30729,2,A1OXSFS5ZDY7NP,Girls
Allen Solly Kids Girls Twill Black Trousers,34721,3,A3AI3DJQ8NI1UX,Girls
Doodle Girls Pink Top,43687,5,A22P8CW9NVJ49H,Girls
Gini and Jony Girls Washed Blue Skirt,34148,5,A3SP22BU1008GV,Girls
Gini and Jony Girls Core Pink Top,41973,4,AFQO7NSU6OSGH,Girls
Disney Kids Girl's White Round Neck Kidswear,2732,1,AX43HESIL985S,Girls
Madagascar3 Girls White Shorts,37560,1,APULYOSZS226A,Girls
Gini and Jony Girls Printed Pink Top,38948,2,A2X0OUA7W3HNZI,Girls
Madagascar3 Girls Pink Shorts,37558,3,A2WE4LU82W1U1L,Girls
Madagascar3 Infant Girls Light Green  T-Shirt,37567,3,A1WSGOA6S3U9OC,Girls
Doodle Girls Saturday 24Am Orange Tshirts,9927,4,A1UUX9VH9XXX0B,Girls
Gini Jony Girls Pink Shorts,36217,5,AHVY2JTMYHWYA,Girls
Gini and Jony Girls Printed Blue Top,39851,5,A2BXY2QG6XXZQR,Girls
United Colors of Benetton Kids Girls Green Printed Top,24945,2,A37860PZPUUY1V,Girls
Chhota Bheem Kids Girls Sea Princess Light Orange T-shirt,21853,2,AY3F1CVHTNVBU,Girls
Doodle Girls Printed White Top,35450,5,A4J7EDWN32459,Girls
Madagascar 3 Infant Girls White Booties,37551,3,AZGGH4GS18RUN,Girls
