ProductTitle,ProductId,Rating,UserId,Gender
Jungle Book Boys Baby Red Clothing Set,35888,5,A1R4UG6BNDBBOL,Boys
Madagascar3 Infant Boys White Snapsuit Romper,37525,4,A2JIQP1H0N7NO5,Boys
Doodle Boys Printed Yellow T-shirt,43696,1,AKWRO5WFQ4I85,Boys
Avengers Boys White T-shirt,48246,1,A1ALXIEJWSM3WX,Boys
Madagascar3 Infant Boys White Shorts,37522,1,A10SBRHY5Z8FT3,Boys
United Colors of Benetton Kids Boys Red Printed T-shirt,24909,3,A3K0Q7BLOD5P0X,Boys
Doodle Boys Printed Yellow T-shirt,43698,4,A3C5QQXTWQQARI,Boys
Jungle Book Boys 11 White T-shirt,35886,4,A1E2DD77GZJWS0,Boys
Gini and Jony Boys Printed Navy Blue T-shirt,34168,3,A35DSJ5BVS8H2A,Boys
Madagascar3 Infant Boys Lemon Yellow Leggings,37514,3,A3LSRSY3F7CWPA,Boys
U.S. Polo Assn. Kids Boys Blue T-shirt,37342,2,A1EQMKGBI0NK71,Boys
Disney Kids Boy's Yellow Polo Tshirt,2746,2,A1DGD9AGZNF6O9,Boys
Doodle Boys Printed Yellow T-shirt,41752,3,A29NE7F0K4WO86,Boys
Gini and Jony Boys Printed Navy Blue T-shirt,33140,4,A2MQ9OGYO9PFGM,Boys
Jungle Book Boys Jungle Friends Blue T-shirt,35881,4,AAKT6MS1SVJDT,Boys
Marvel Boys Comics Blue T-shirt,35875,5,A3995A1MLGMSZK,Boys
United Colors of Benetton Kids Boys Navy Blue Printed T-shirt,24907,3,A2NU51KZVY9J9Z,Boys
U.S. Polo Assn Boys Blue T-Shirt,37345,3,A5VR137GUB7JQ,Boys
The Amazing Spiderman Boys Black T-shirt,48248,1,A33ZO6NTU56R7F,Boys
Madagascar 3 Infant Boys White Booties,37513,5,A1CZJUWPTGMYU1,Boys
Doodle Boys Check Black Shirt,34104,5,A1X5WU8A9F3CGU,Boys
Nike Kids Boys Printed Black T-shirt,22637,4,AV7UMGQ691DK1,Boys
Gini and Jony Boys Printed Blue T-shirt,38957,1,A2QOSIWDC04CQE,Boys
Madagascar 3 Infants Boys Yellow Tshirt,37547,2,AFGSFCRCRTDZW,Boys
Gini Jony Boys Black Jacket,36208,1,A5I24CK8LXFGK,Boys
ADIDAS Kids Boys Solid Red Sweatshirts,15046,3,A1OUIKYDQEFYLD,Boys
Ben 10 Boys Crew Navy Blue and Green T-shirt,36002,1,A15X79PP60MX8I,Boys
Doodle Boys Printed Green T-shirt,34103,5,A26VOR2AJIQACH,Boys
Gini Jony Boys Black Shirt,36206,2,A22O1W9O7GZ4HQ,Boys
Disney Kids Boy's White Red Kidswear,2724,1,AHLGH2F0U2J1P,Boys
Gini and Jony Boys Rodeo Blue Jacket,38992,2,A3BZHI48MZWE7D,Boys
Gini and Jony Boys Printed Yellow T-Shirt,39840,2,A2ZOBO61LUU9MX,Boys
Gini and Jony Boys Printed Navy Blue T-shirt,38959,4,AJB6NXJLATQLT,Boys
Gini and Jony Boys Check Black Shirt,41991,5,A2Y03TL0BHT9GP,Boys
Gini and Jony Boys Surfs Up Black T-shirt,41965,5,A2K3J2X8KDY47N,Boys
Gini and Jony Boys Comics Blue Jeans,38995,3,A1RZ3K1WJGL4NQ,Boys
Gini and Jony Boys Printed Grey T-shirt,38961,3,A2E3A2RVDKR771,Boys
Gini and Jony Raw Wash Navy Blue Jeans,41962,2,AFBKNXXLDHAB1,Boys
Chhota Bheem Kids Boys Lets Rock Green T-shirt,21873,5,A3SRKLG52BYLUK,Boys
United Colors of Benetton Kids Boys Pink Printed T-shirt,24906,3,A3PM6JNMDEVM7E,Boys
Marvel Boys Comics Grey T-shirt,35874,2,A4VK8BMGESPI5,Boys
Jungle Book Boys Royal White T-shirt,35880,3,A1O0DIGKJ86BHF,Boys
Disney Kids Boys Little Captain Pack of 2 Red Green T-shirt,9952,1,A2BLA13SDC5T4,Boys
U.S. Polo Assn Boys Red T-Shirt,37344,3,AMT0DCOCA21RP,Boys
Madagascar 3 Infant Boys Blue Booties,37512,3,A1JM12YT8HJPIY,Boys
Doodle Boys Printed White T-shirt,41754,3,A3JQ6K6HMGJ1UJ,Boys
Gini and Jony Boys Blue Shorts,33146,2,A1T6PQ4F5BMKLU,Boys
Jungle Book Boys Mowgali Yellow T-shirt,35887,4,A2M465PCYH4GO,Boys
Marvel Boys Comics White T-shirt,35873,4,A285JA5679NN5R,Boys
Palm Tree Boys Printed Green T-shirt,33141,1,AI0OVCUJR9OJ7,Boys
Doodle Boys Printed Red T-shirt,41753,1,A1HOHCNICEHXMS,Boys
Madagascar3 Infant Boys Blue Leggings,37515,1,AFERMR9RNPIWQ,Boys
U.S. Polo Assn Boys Black T-Shirt,37343,1,A1QWXTY2E1CL1M,Boys
United Colors of Benetton Kids Boys Navy Blue T-shirt,24937,1,A1W9QAR7P545IC,Boys
Avengers Boys Blue Printed T-shirt,48247,5,A2OABXN4XL95EZ,Boys
Doodle Boys Printed Red T-shirt,43690,4,A19SYHAYNJ9JVK,Boys
Madagascar3 Infant Boys Lemon Yellow Snapsuit Romper,37523,3,A3UMZJNP10AYSY,Boys
United Colors of Benetton Kids Boys Yellow Printed T-shirt,24908,5,A12VP1FB3XFE3X,Boys
Avengers Boys Yellow Printed T-shirt,48240,5,A13H09FTCEJ3DT,Boys
Madagascar3 Infant Boys Light Blue Snapsuit Romper,37524,5,A1DIFU982SVOWN,Boys
Doodle Boys Printed White T-shirt,43697,5,A2S5RNR6COYAET,Boys
United Colors of Benetton Boys Navy Blue Waistcoat,42583,5,AY807FN55W64H,Boys
Jungle Book Boys Follow The Tracks Yellow T-shirt,35889,1,A3FZMX1TWGZBN2,Boys
Gini and Jony Boys Printed Grey T-shirt,38960,4,AV8B99IXQ8Y5P,Boys
Gini Jony Boys Printed Red Jacket,36200,2,AEW1MYAVRF9AV,Boys
Disney Kids Boy's Denim Mickey Surf Kidswear,2722,3,A3HLTS6OQ0FSEU,Boys
Gini and Jony Boys Jeans Blue Jeans,38994,1,A1Q9CAJYEXJVI5,Boys
Nike Boys Running Green Jersey,31446,4,A3CUXT1VPITD3Z,Boys
Gini and Jony Boys Rodeo Blue Jeans,38993,4,A3N0MV3L54UYYM,Boys
Nike Kids Boys Printed Grey T-shirt,22638,2,A197BFZ8BSVSO2,Boys
Gini and Jony Boys Printed Navy Blue T-shirt,38958,5,A32HJYC8GF242S,Boys
Gini and Jony Boys Check Black Shirt,41990,5,A18LPZUN80X919,Boys
Ben 10 Boys Crew Green T-shirt,36003,5,A3HRQCE6UXGU6V,Boys
Doodle Boys Printed Pink T-shirt,34102,1,A1IMIQYOBRBG34,Boys
Doodle Boys white Printed T-Shirt,52122,5,A1VZ46Z02VRPY0,Boys
Doodle Boys Check Black Shirt,35440,2,A3T5G7XZPODEXS,Boys
Chhota Bheem Kids Boys Lost Alien Green T-shirt,21843,5,A2IZAUI0ISLA85,Boys
Gini and Jony Boys Printed Blue T-shirt,38956,2,A2W4RS26XT2O1S,Boys
Doodle Boys Check Blue Shorts,34105,5,A3KEZLJ59C1JVH,Boys
Disney Kids Boy's Red Goofy Surf Kidswear,2714,2,AFCD4K00EGXOB,Boys
Gini and Jony Boys Black Cargo Shorts,13343,1,ALZWGAK15U76X,Boys
Ben 10 Boys Crew Yellow T-shirt,36004,4,A31EM66K6Z68KC,Boys
Gini Jony Boys Grey Jacket,36209,1,A3IACAOXMJ4AWJ,Boys
Nike Boys Running Blue Shorts,31448,2,AZLYAJ8XE443K,Boys
Gini and Jony Boys White Shirt,34048,5,A17P9WVPU4V6PN,Boys
Gini & Jony Boys White T-shirt,39333,3,AENZH8I66SN2H,Boys
Gini and Jony Boys Printed Navy Blue Blazer,31161,2,A2JY2G1Y276N9X,Boys
Ben 10 Boys Crew Red T-shirt,35999,2,A3L5UVIK1WPW9,Boys
Gini and Jony Boys Printed White T-shirt,33252,4,A2KKKT4H1IWSI1,Boys
Palm Tree Boys Printed Black T-Shirt,36720,4,ABRMU6JBX6RBG,Boys
KKR Boys Fangear Tee,3324,4,A3EM0Y7C1USH9C,Boys
Gini & Jony Boys White T-shirt,39334,4,A1LI7U7O30ZTS0,Boys
Gini and Jony Boys Black T-shirt,31159,3,A1R5SZCC41T6BS,Boys
Gini Jony Boys Beige Shorts,39750,3,A1OJR3QWWI3SIP,Boys
Gini and Jony Boys Printed Yellow T-Shirt,36718,5,A27C38RA5ODEPM,Boys
Disney Kids Boy's Baby Mickey Surf Kidswear,2695,5,A38ZCQ9QE0M7VJ,Boys
Madagascar3 Boys White Printed T-Shirt,37601,2,A1CEEKM1DJNJLC,Boys
Gini and Jony Boys Printed Green T-shirt,33255,4,AQA1M1H49DVEN,Boys
Gini and Jony Boys Washed Blue Denim Shorts,31166,1,A24N4FKHGD7DWT,Boys
Ben 10 Boys Crew Black T-shirt,35997,5,A2EKFM9X9O00QZ,Boys
Gini and Jony Boys Check Blue Shirt,40133,2,A25FKNAQ44EIT9,Boys
Ant Kids Boy's Whats Up Navy Kidswear,5486,4,A18IG4QUWXM3EK,Boys
Gini and Jony Boys Printed Navy Blue T-shirt,31150,3,AEX8R21PA0SIT,Boys
Gini Jony Boys Brown Shorts,39759,4,AIF5FN49UOUI2,Boys
Gini & Jony Boys White T-shirt,33263,3,A1NUF0VO9F4DA5,Boys
Gini and Jony Boys White Shirt,34046,2,A11KQ5BUQJQQXQ,Boys
Doodle Boy's I am Handsome No1 Yellow Kidswear,8355,1,A29UKEGELP56OH,Boys
Gini and Jony Boys Beige Shorts,33264,5,A1DPZHFRQ0QO0L,Boys
Gini and Jony Boys Printed White T-Shirt,36716,2,A2TBR7OFH9LCJH,Boys
Gini and Jony Boys Check Red Shirt,34041,2,A17922269PBKN0,Boys
Gini and Jony Boys Green T-shirt,31157,1,A1CX180P3XV2LK,Boys
Gini and Jony Boys Pack Of Two White T-shirt,41012,1,A2TQ5X2N533FUV,Boys
Gini and Jony Boys Black T-shirt,50194,5,A36FXHSXME1KHM,Boys
Gini and Jony Boys Check Black Shirt,40134,2,A1PI3FNO5WDWT8,Boys
Gini and Jony Boys Printed Black T-shirt,31103,2,A30IJLUCHAUVXP,Boys
Ant Kids Boy's Love This Game White Kidswear,5421,3,A1A8S7LLTESNYX,Boys
Mr. Men Boys Mr. Noisy Yellow T-shirt,36326,5,A3O3J3ZTTBFFZL,Boys
Gini and Jony Boys Raw Wash Navy Blue Jeans,40160,3,A3D6VUXMZD4MFJ,Boys
Batman Boys Multi Coloured T-shirt,38248,4,A25M5BYKVESDFV,Boys
Mr. Men Boys Tickle Yellow T-shirt,36319,5,A2OM0YG07EG46K,Boys
Marvel Boys Green T-Shirt,38283,3,A2FD3OSAUO10KC,Boys
Do u speak green Boys T-shirt,54907,1,A12712009FURQ7,Boys
Gini and Jony Boys Pack of 2 T-shirts,31104,3,A20K1KY98O39AJ,Boys
Doodle Boy's 77 Juniors League White Black Teen Kidswear,8339,5,A1WC62CBNGZ0JO,Boys
Ant Kids Boy's Black Cartoon Pop Kidswear,5426,2,AV8NAHORFJ89L,Boys
Mr.Men Boys A Lot Of Work Blue T-shirt,36321,2,AHO0EM3FIG4JN,Boys
Doodle Kids Boys Soccer Blue T-Shirt,25504,4,A3UDBOJWNL60SI,Boys
Disney Kids Boy's Yellow Little Friends Kidswear,4190,4,A35TXO343KBBA3,Boys
Ant Kids Boy's Musical Buzz Black Red Kidswear,5419,5,A2VLDZ8XJYETY6,Boys
Marvel Boys Green Printed T-shirt,38284,3,A3DLT0BMEE365A,Boys
Gini and Jony Boys United White T-shirt,40151,3,A1OCZ3L1AYALDL,Boys
Gini and Jony Boys Printed White T-shirt,34024,2,A1YPM4GCO8I1W1,Boys
Mr.Men Boys Blazing Yellow T-shirt,36317,3,AOGJ43H5ZZPLM,Boys
United Colors of Benetton Kids Boys White Striped T-shirt,24873,2,A1RD20XYLN12SH,Boys
Gini and Jony Boys Wild West Red T-shirt,40952,1,A35X23L1HE949R,Boys
Batman Boys Green Printed T-shirt,38246,2,A3BNGLUQXZ1KKA,Boys
Doodle Boy's Car Print White Green Blue Kidswear,8330,1,A1KGBY16OOW8B9,Boys
Disney Kids Boy's Yellow Royal Sailing Kidswear,4199,5,A1FEU7BZ9KIN0G,Boys
Allen Solly Kids Boys Flock Print Red T-shirt,38884,1,A1MFI4ANYE70CO,Boys
Mr.Men Boys Blazing Yellow T-shirt,36310,2,A2X84CP4G541QE,Boys
Palm Tree Boys Printed Green T-shirt,34023,3,A365JZ3HRICWVD,Boys
Doodle Boy's 77 Juniors League Red White Teen Kidswear,8337,1,A25RLARPMG0V4Q,Boys
Gini and Jony Boys Rodeo Red T-shirt,40955,2,A3RQ6QXF6VQ6S6,Boys
United Colors of Benetton Kids Boys Maroon Striped T-shirt,24874,4,ADI3IAXO8EH2E,Boys
Chhota Bheem Kids Boys Yeh Dosthi Rust Tshirt,17807,4,A3A1U6WSSNW70X,Boys
Doodle Boy's I am Handsome No1 Rust Kidswear,8354,3,A3UMVASITREVNQ,Boys
Gini and Jony Boys United Red T-shirt,38480,1,A1MNSSE2ITIIGA,Boys
Gini and Jony Boys Aviator White T-shirt,40135,1,AXNY2ZN9PZ6WT,Boys
Gini and Jony Boys White Check Shirt,43582,4,A1X8IHGTV6UAUA,Boys
Gini and Jony Boys Black T-shirt,50195,3,AP8RB98O4BHCI,Boys
Gini and Jony Boys Printed Yellow T-Shirt,36717,2,A1ZOSGXEP5AB8N,Boys
Gini and Jony Boys Check Red Shirt,34040,3,AR1K8G3CGD1QI,Boys
Gini and Jony Boys Blue T-shirt,31156,2,A1I0KD965AM5Z6,Boys
Ben 10 Boys Crew Yellow T-shirt,35996,2,A39LUXG3UUL7ER,Boys
Doodle Boy's Original Royal Classic White Kidswear,8353,2,A1I0UF9XDVW6LS,Boys
Gini and Jony Boys Printed Blue T-shirt,31151,5,A29CP88NRDGHP9,Boys
Gini Jony Boys Brown Shorts,39758,2,A2XTKRTDPMCSJH,Boys
Gini and Jony Boys Printed White T-shirt,33262,5,A13ZNKJNVW0ZWZ,Boys
Gini and Jony Boys Authentic Red Shirt,40132,2,A85T1DDMF4OMD,Boys
Gini and Jony Boys Yellow T-shirt,31158,2,A37J8XKLNOX2RO,Boys
Gini and Jony Boys Printed Black T-Shirt,36719,4,A1QSOTG7XORCGN,Boys
Gini and Jony Boys Polo Black T-Shirt,36726,4,A15VUTJ9QOJEEI,Boys
Gini and Jony Boys Red T-shirt,33254,4,A3G7GGKJY868TX,Boys
Disney Kids Boy's Red Twofur Layered Kidswear,2694,3,A2DETKKJK1ZO8F,Boys
KKR Boys Fangear Polo Jersey,3322,4,A1AAJGGLN1YG5Q,Boys
Madagascar3 Boys Red Printed T-Shirt,37600,5,AUYIPQDAHNOBK,Boys
Gini Jony Boys White Shorts,39756,2,A3EN8SX1B1Z3IZ,Boys
Gini and Jony Boys White Shirt,34049,1,ADXA5B6FX59W8,Boys
Gini & Jony Boys White T-shirt,39332,5,AKJRFNIHPE3EI,Boys
Gini and Jony Boys Pink Shirt,46831,3,A2SKNJGP1X7IE1,Boys
Disney Kids Boy's Yellow Kidswear,2693,1,A1UMLOFY7DN2Z6,Boys
Ben 10 Boys Crew White T-shirt,35998,1,AGZSDV2ZYC7YW,Boys
Gini and Jony Boys Printed Dark Navy T-Shirt,36721,1,A3S5CEM6TF7I8S,Boys
Gini and Jony Boys Printed Yellow T-shirt,33253,5,A20LSQZJPJHB0H,Boys
Disney Kids Boy's White Mickey Abhoy Red Set of 2 Kidswear,5214,3,A3317L1113QN7O,Boys
Mr.Men Boys Wonderful Black T-shirt,36311,5,A3ABTLXPQP73TB,Boys
Palm Tree Boys Printed Green T-shirt,34022,5,A2P2FTA24RAFBA,Boys
Gini and Jony Boys Rodeo Red T-shirt,40954,3,A2CB2CNAOCG97W,Boys
Doodle Boy's 77 Juniors League Red White Kidswear,8336,3,A29WP9HRKLQS0D,Boys
Gini and Jony Boys Printed White T-shirt,34025,5,A3DXBLP5Q1KRQA,Boys
Mr.Men Boys Mr. Messy White T-shirt,36316,4,A3JRZEM49Z26XF,Boys
Gini and Jony Boys Surfs Up Grey T-shirt,40150,4,A2S0G8DCA96BXJ,Boys
Doodle Boy's Car Print Teen Kidswear,8331,3,A1BIVBZ6OV1SU0,Boys
Disney Kids Boy's Red Royal Sailing Kidswear,4198,2,A3LGXU7YL8RPF0,Boys
Batman Boys Blue Printed T-shirt,38247,1,AH1Q6CFL3C8TR,Boys
Gini and Jony Boys Rodeo Yellow T-shirt,40953,4,A34Z2ZB23YJ452,Boys
Doodle Kids Boys Soccer White T-Shirt,25505,3,A5IYFBQ25IVN6,Boys
Doodle Boy's 77 Juniors League White Black Kidswear,8338,5,A1T7O0U15G2OXX,Boys
Gini and Jony Boys Pack of 2 T-shirts,31105,3,A1VIKBGCPW22YC,Boys
Ant Kids Boy's Red Cartoon Pop Kidswear,5427,1,A2U71ZBMQCJ7TC,Boys
Mr.Men Boys Oh Dear Blue T-shirt,36320,3,A2EDV2NPKN69YM,Boys
Disney Kids Boy's Green Little Friends Kidswear,4191,1,A3KOU7EJZX3Z3O,Boys
Ben 10 Boys Red Printed T-shirt,38249,1,A3E3ZSEKGWFUGZ,Boys
Gini and jony Boys Printed Red T-shirt,31102,4,A2A118C3EOJLL6,Boys
Ant Kids Boy's Love This Game Blue Kidswear,5420,3,A29DZ36SLTMZOI,Boys
Allen Solly Kids Boys Oxford White Shirt,34689,1,A3Q3PRW1YR3Q3Q,Boys
DC Comics Boys Red T-shirt,38282,4,A36A5S1NI653AQ,Boys
Mr. Men Boys Mr. Bump Red T-shirt,36318,5,A3EB7LZY4SO8S4,Boys
Gini and Jony Boys Maroon Shirt,34050,2,A2IS0IGSQ79ECX,Boys
Madagascar3 Boys Yellow Printed T-Shirt,37621,3,A2H8Z04RWXZQ85,Boys
Chhota Bheem Kids Boys Spare Me TShirt,15571,3,A96GJTT3M3WYU,Boys
Gini and Jony Boys Customised Black Shorts,40125,3,A1JB41F8U79KIE,Boys
Doodle Boys Navy Blue Printed T-Shirt,50718,1,A1PQ6KU1TUNNGL,Boys
Gini and Jony Boys Pack Of Two White T-shirt,38490,3,A2UIJN42ZLCW8S,Boys
Gini and Jony Boys Comics Blue Jeans,40926,4,A9EPRATZ1GW1F,Boys
Chhota Bheem Kids Boys Double Trouble TShirt,15576,4,A32ZIX6JXPJX3O,Boys
Gini and Jony Boys Washed Blue 3/4 Length Pants,34057,1,A394ODETD69NJP,Boys
Palm Tree Boys Yellow T-shirt,38497,4,A2S6E2EQ2CM7FG,Boys
RCB Boys Fangear Tee,3332,2,A1HX1D929O8PJD,Boys
Tantra Kid's Unisex Stop Turqoise Kidswear,4325,3,AB24Z8PTNQ33I,Boys
Gini and Jony Boys Rodeo Blue Jeans,40928,4,A3CMSS365AM46L,Boys
Ant Kids Boy's Musical Buzz Green T-Shirts Kidswear,5455,3,A1HSQHFM8V63BF,Boys
Gini and Jony Boys Printed White T-shirt,31148,4,A2OBFNZFMB8R4F,Boys
Nike Boys Black & White Reversible T-shirt,30600,5,A26CIZL1C18YQH,Boys
Gini and Jony Boys Grey Shorts,34059,4,A1TFQ2STVBDBUT,Boys
Doodle Boy's Stripper Green Kidswear,8326,4,AAXLAV096NKIL,Boys
Gini and Jony Boys Shirt White Shirts,41298,4,A277CKSB8I4VZW,Boys
Gini and Jony Boys Check Green Shirt,34032,4,A3OMRT3JNDDHU8,Boys
Doodle Boy's Route 66 Biker Red Kidswear,8319,3,A12229EA9OZZJM,Boys
Disney Kids Boy's Blue Stripes Little Captain Kidswear,4188,5,A2EDAQWOCTY40G,Boys
Doodle Boy's Route 66 Biker Blue Kidswear,8321,5,A1TMM08V2ZX5ST,Boys
United Colors of Benetton Boys Printed White Shirt,37220,4,AED3WS57LEQ1B,Boys
Gini and Jony Boys Core Red T-shirt,40140,1,A1YA6EYCAF3UCE,Boys
Gini and Jony Boys Core Blue T-shirt,40988,1,A1ESDW5VX6B73Q,Boys
Gini and Jony Boys Check Navy Blue Shirt,34035,5,ACC4II22TY40E,Boys
Gini and Jony Boys United Green T-shirt,40975,5,A5UQ7Y4PGN63T,Boys
Gini and Jony Boys Washed Blue 3/4 Length Pants,31115,3,A46TQBGKSLLY4,Boys
Doodle Boy's Stripper Blue Kidswear,8328,4,AVMNS3FP7YMU3,Boys
Gini and Jony Boys United White T-shirt,40986,5,A1F3O7497UYRUV,Boys
Ant Kids Boy's White Check Kidswear,5430,5,A3ULP7B2QOVYRW,Boys
Gini and Jony Boys Yellow 3/4 Length Pants,31112,1,AV910Z21Q4DUR,Boys
Gini and Jony Boys Washed Navy Blue 3/4 Length Pants,34058,5,A1S0YCERQMTLWX,Boys
Doodle Boys white Printed T-Shirt,50717,3,A18GFWX5GYOU3F,Boys
Gini and Jony Boys Grey Shorts,34060,1,A2RAI0BVLV19UH,Boys
Gini and Jony Boys Rodeo Blue Jeans,40929,3,AU5FVIIDW0VIF,Boys
Gini and Jony Boys Printed Red T-shirt,31149,4,ATVBB0P7JPJE7,Boys
Gini and Jony Boys Washed Blue 3/4 Length Pants,34056,4,A2VAHEBP5LECKG,Boys
Gini Jony Boys Beige Shorts,39749,1,A2CYGU98CZQNH5,Boys
Chhota Bheem Kids Boys Warrior Bheem TShirt,15577,3,A1WVWKP2NO09BZ,Boys
Gini and Jony Boys United White T-shirt,38496,1,A17XYI0YG5UHW3,Boys
Madagascar3 Boys Green Printed T-Shirt,37620,1,ASDYXS80RUUO0,Boys
Chhota Bheem Kids Boys Flying High TShirt,15570,5,A2X7QHR5ZQA0HR,Boys
Gini and Jony Boys Wild West Blue T-shirt,40124,2,A3OFKO6HR06L0V,Boys
Gini and Jony Boys Check Blue Shirt,31147,4,A3KL8WSLJPSWMR,Boys
Palm Tree Boys Maroon Shirt,34051,1,AHUQSDM26UH5C,Boys
Gini and Jony Boys Comics Blue Jeans,40927,3,ATJ6S9R0W10JS,Boys
Gini and Jony Boys Core White T-shirt,38491,1,A3KT64AAQTXIG0,Boys
Gini and Jony Boys Printed Yellow T-shirt,39315,4,AMWWXJA8PUX1U,Boys
Gini and Jony Boys Core Blue T-shirt,40987,4,A1Z6G0LOBCJQB4,Boys
Disney Kids Boy's Royal Sailing Yellow Teen Kidswear,4725,3,A165V5XOD0LNSR,Boys
Ant Kids Boy's Pink Check Kidswear,5431,2,A116ITN8WDR1M4,Boys
Gini and Jony Boys Washed Navy Blue 3/4 Length Pants,31113,1,A1WFDC6D0QXZYQ,Boys
Gini and Jony Boys Core Yellow T-shirt,40980,5,A2SZVB853VZCAP,Boys
Gini and Jony Boys United Green T-shirt,40974,1,A3EA0MI9BVJXBE,Boys
Gini and Jony Boys Washed Blue 3/4 Length Pants,31114,2,A1LAIQIVHMO1K7,Boys
Disney Kids Boy's Red Stripes Little Captain Kidswear,4189,2,A19C4WE5N9WJLU,Boys
Doodle Boy's Route 66 Biker Red Teen Kidswear,8320,3,A3GWYPIMLSRQ7P,Boys
Palm Tree Boys Check Navy Blue Shirt,34034,4,AUHNJA6JGCTBT,Boys
Gini and Jony Boys Core Blue T-shirt,40141,3,AJDANTTLD8MFD,Boys
United Colors of Benetton Boys Check Olive Shirt,37221,1,A1HCGIOWZR6ANG,Boys
Doodle Boy's Stripper Green Teen Kidswear,8327,1,ANJZ5ZHBL3IW7,Boys
Palm Tree Boys Check Green Shirt,34033,4,A1T6L23XRNG29L,Boys
Gini and Jony Boys Striped Yellow T-Shirt,39834,1,AJOB6PJUVTRPV,Boys
Disney Kids Boy's Red Mickey Since 1928 Tee Kidswear,4205,3,A1NUFF9K8QS800,Boys
The Amazing Spiderman Boys Black T-shirt,48259,5,A1GK2INST7GB8R,Boys
Jungle Book Boys Sherekhan Navy Blue T-shirt,35890,2,A2L8AWOIWML9CH,Boys
Fabindia Boys Red & Beige Angarakha Dhoti Set,30718,2,ATIRQXBP4EI6A,Boys
Chhota Bheem Kids Boys Bheem Expressions Yellow T-shirt,21838,5,A209TMH7LYEQ2E,Boys
Disney Kids Boy's Navy Crew Sea Life Sialing Kidswear,4202,5,A2K0LCQYPQUIJZ,Boys
Fabindia Boys Printed Blue Kurta,30720,3,A2ZJA6MEWOMOJ,Boys
United Colors of Benetton Kids Boys Grey Printed T-shirt,24911,1,AE1TYBYU5DEO9,Boys
Doodle Boys Printed Red T-shirt,43689,2,A2OAQJNHIBCZNY,Boys
Doodle Boys-Boys Washed Blue Jeans,18181,5,A3U80NITRNK3H8,Boys
Gini and Jony Boys Navy Blue T-shirt,34179,4,A34I5YAH6R5S46,Boys
Chhota Bheem Kids Boys Lets Rock Grey T-shirt,23133,4,A2JIPZOSXOL8Z2,Boys
Gini and Jony Boys Yellow T-shirt,34184,5,AQJGHMVO5X1BW,Boys
Fabindia Boys Blue Dhoti Angarakha Set,30716,1,A37EU510VFU94X,Boys
Madagascar3 Boys Yellow Innerwear Vest,37533,5,AN3JGQI2TTRR,Boys
Gini and Jony Boys Maroon Shirt,31092,3,A3UL5IMEIU8LE2,Boys
United Colors of Benetton Boys Blue Slim Fit Jeans,42594,5,A1ICCX3BW0LF2U,Boys
Gini and Jony Boys Printed Blue T-shirt,34170,1,A1K0G3T86YMLCN,Boys
The Amazing Spiderman Boys Red T-shirt,48257,5,ACJFZTWV1JDX4,Boys
Do u speak green Boys Olive Trousers,54896,3,AU6KEYBL3TP0W,Boys
Gini and Jony Boys White T-shirt,34177,4,A3PYK302AW6T5G,Boys
Disney Boy's Marked Red Teen Kidswear,4465,3,A1Z2CRE6J1CJTK,Boys
Doodle Boys Check Blue Shorts,35435,2,A1FFN2X53EMZNW,Boys
Madagascar3 Boys Blue Innerwear Vest,37534,4,A2WJ1QHYKQLOJH,Boys
Gini and Jony Boys Green T-shirt,34183,1,A2N20UD9IPYRMT,Boys
Chhota Bheem Kids Boys I Like to Paint Navy Blue T-shirt,23134,1,A3O3EWC47LHLR0,Boys
Gini and Jony Boys Core Red T-shirt,39001,5,A1GEPOLRTX9VK1,Boys
Disney Kids Boy's Orange Just Cruising Kidswear,3815,5,AGFK00WA60WTN,Boys
The Amazing Spiderman Boys Red T-Shirt,48250,5,A34CQ14M1Y6WM0,Boys
Gini and Jony Boys Core Blue T-shirt,41987,3,A18GH4M4IZF5DG,Boys
Gini and Jony Boys Washed Grey Jeans,33306,5,A14G2D00311D5G,Boys
Madagascar 3 Boys Green Printed T-Shirt,37594,2,A332JM04UGCD99,Boys
Gini and Jony Boys Red Printed T-Shirt,46731,5,A3IV9LLG3264F1,Boys
Gini and Jony Boys Printed Black T-Shirt,39856,4,A5663WRAL9LZ7,Boys
Gini and Jony Boys Rodeo Red T-shirt,38984,5,AIGO7WT50WPS8,Boys
Doodle Boys Printed Green T-shirt,35461,3,A1944K0ACKLRPO,Boys
Gini and Jony Boys Rodeo White T-shirt,41980,1,AHQIFXFV3A8LZ,Boys
Superman Boys Blue T-Shirt,38346,2,AMVOLO7IF3RHO,Boys
Doodle Boys Printed Pink T-shirt,35459,3,A8WDVBE6E7VGK,Boys
Nike Boy Grey T-shirt,22628,1,A2CD2WAOCV5950,Boys
Madagascar3 Boys Yellow Printed T-Shirt,37593,3,A2OWDQDHAD8C67,Boys
Gini and Jony Boys Printed Yellow T-Shirt,39858,2,A3ICTV26DK6IP9,Boys
Gini and Jony Boys Solid Black Jeans,33308,1,AHM4FL8ZLPI2R,Boys
Gini and Jony Boys Blue Shorts,38941,4,A1L484AD92GHD,Boys
Gini and Jony Boys Check Blue Shirt,41989,1,A1FK1X14UEHRH2,Boys
Doodle Boys White Striped T-Shirt,52132,2,A3O8WK0NRXHGOO,Boys
Ant Kids Boys Multicoloured Striped T-shirts,12844,2,A3SEDTPDP0G66D,Boys
Gini and Jony Boys Polo Green T-Shirt,39860,4,A1KRSGSTBEPW88,Boys
Doodle Boys Printed Grey T-shirt,35457,1,A1HQT5S6EYBZ9Y,Boys
Doodle Boys Printed White T-shirt,43686,4,ADWU2VMS20Q9O,Boys
Disney Boy's Jack Sparrow Fight Red Teen Kidswear,4464,1,A1CIGI2TSUCYUY,Boys
Gini and Jony Boys Check Red Shirt,31094,1,A2JVOKZG094NU8,Boys
Chhota Bheem Kids Boys Lets Rock Green T-shirt,23135,5,A1J3MJER08S0RE,Boys
Gini and Jony Boys Green T-shirt,34182,1,A24N38QSNPZFBG,Boys
Gini and Jony Boys White T-shirt,34176,4,A3SYPIB569VQ35,Boys
Disney Kids Boy's Street Crew Blue Kidswear,3814,3,A1PX8KN00QK7NI,Boys
The Amazing Spiderman Boys Off White T-Shirt,48251,4,A1E7VFQXWR6PZL,Boys
United Colors of Benetton Boys Grey Slim Fit Jeans,42595,5,AAV2LL1CHSS1Z,Boys
Gini and Jony Boys Printed Blue T-shirt,34171,3,A1ANSEIOG2SKSG,Boys
Fabindia Boys Green Dhoti Angarakha Sets,30717,3,A1TV04CUG2RYUM,Boys
Madagascar3 Infant Boys Light Blue T-Shirt,37532,3,A2MW7SK362PEQC,Boys
Gini and Jony Boys Black T-shirt,34185,5,AQ9QSP7TSXWMO,Boys
Gini and Jony Boys White Shirt,31093,4,A6Q333B17B8VN,Boys
The Amazing Spiderman Boys Navy Blue T-shirt,48256,4,A2OZ3C4OI1CWIF,Boys
Disney Kids Boy's Street Crew Yellow Kidswear,3813,2,A1S37V71PUP922,Boys
Nike Boys Stripy Crew Blue T-shirt,25035,2,A3AW04VA6I847R,Boys
Gini and Jony Boys Blue Denim Shorts,34147,3,A3S7MD1Y2P5ZU,Boys
Disney Kids Boy's Blue Regatta Annual Competition Kidswear,4203,5,A2DISAAASL95JA,Boys
Fabindia Boys Printed Green Kurta,30721,5,A3TWAD5ILUNR7M,Boys
Superman Boys Crew White T-shirt,35896,5,A3FLN91OHH4WKM,Boys
Gini and Jony Boys Navy Blue T-shirt,34178,4,A1SLXJ1RQF1BNQ,Boys
Doodle Boys-Boys Acid Wash Blue Jeans,18180,3,A14B8VX7Q3FL30,Boys
United Colors of Benetton Kids Boys Navy Blue Printed T-shirt,24910,4,AEMXQDJ00L6NW,Boys
Disney Kids Boy's White Regatta Annual Competition Kidswear,4204,1,A1HCI057NYILM6,Boys
United Colors of Benetton Boys Check Grey Waistcoat,37167,4,A23303YJ03VIXL,Boys
The Amazing Spiderman Boys Black T-Shirt,48258,5,A1STMW7DCY3SB9,Boys
Gini and Jony Kids Solid Black Trousers,13306,5,A2JK23TE1H4BPS,Boys
Doodle Boys Printed White T-shirt,41745,3,A334RW0AL6LXIC,Boys
Jungle Book Boys Ponya 11 Yellow T-shirt,35891,4,A3KALGW63GCJ50,Boys
Ant Kids Boys Arrow Maroon Tshirts,12845,1,A354QYZ9IN2L4Z,Boys
Doodle Boys Printed Grey T-shirt,35456,2,A1W6BXL1DS9AC2,Boys
Gini and Jony Boys Polo Green T-Shirt,39861,1,A1Z2217U6E72RW,Boys
Palm Tree Boys Printed Yellow T-Shirt,39859,5,A2LJNGUUHHG0T7,Boys
Palm Tree Boys Solid Black Jeans,33309,4,A5T58X73B299A,Boys
Palm Tree Boys Blue Shorts,38940,3,AHA3QV2JX0MS5,Boys
Gini and Jony Boys Check Blue Shirt,41988,2,A31Q1BMH0AE52Q,Boys
Superman Boys White Printed T-shirt,38347,2,A18MCI81UN5SA0,Boys
Doodle Boys Printed Pink T-shirt,35458,3,A3SXO9YG5TLTKI,Boys
Gini and Jony Boys Rodeo White T-shirt,41981,5,A3F6DQDDBG280C,Boys
Gini and Jony Boys Around The World Navy Blue T-shirt,41986,2,A3SYJB7D8UMZGL,Boys
Doodle Boys Printed Green T-shirt,35460,3,A37FVYQ42TWAIP,Boys
Madagascar3 Boys Printed Blue T-Shirt,37595,3,AO3EOJXASL2KH,Boys
Gini and Jony Boys Washed Grey Jeans,33307,5,A3VELSUPKZW1OI,Boys
Gini Jony Boys Blue Shorts,36211,5,A3V6XH83NM7XCC,Boys
Gini And Jony Boys Printed Yellow T-Shirt,39857,1,A4FOZ9QE2DHVT,Boys
Gini and Jony Boys Comics Red T-shirt,38985,4,A17NX3HYUUGR98,Boys
Madagascar3 Infant Boys Lemon Yellow T-Shirt,37543,3,A3LR80PCE3JS0U,Boys
Gini and Jony Boys Pack of 2 T-shirts,38953,4,A1THPD9J4BV1ME,Boys
ADIDAS Kids Boys Printed Black Tshirts,15045,5,A26THXR69AC6VO,Boys
Ben 10 Boys Crew Orange T-shirt,36001,1,A6VIJAS6NNKDS,Boys
Doodle Boys Printed Blue T-shirt,34100,3,A7JUF6RQJH8JM,Boys
Doodle Boys white Printed T-Shirt,52120,3,A1GL5EA1C5HV4I,Boys
Doodle Boys Yellow Printed T-Shirt,52127,5,A3HQ5QK9B5S2UA,Boys
Gini and Jony Boys United White T-shirt,41968,2,A2SBS3UHLX3VTO,Boys
Gini and Jony Boys Printed Green T-shirt,38954,4,A2J9WFBCZ2BXG4,Boys
Madagascar3 Infant Boys Light Blue T-Shirt,37544,4,A5H0JGPPLKTRJ,Boys
Gini and Jony Boys Surfs Up Grey T-shirt,41957,4,AEXT8OH19RD9F,Boys
Gini Jony Boys White Shorts,36202,3,A6B5BH625L79M,Boys
Disney Kids Boy's Mickey Mouse Print Pants,2720,5,A1DWO6LM6ZI9TT,Boys
Gini and Jony Boys Printed Dark Navy T-Shirt,39844,3,A14ECXQPMH5IAO,Boys
Gini and Jony Boys Rodeo Blue Jeans,38996,5,A22ZWGXZBHYLJ5,Boys
Gini and Jony Boys Raw Wash Navy Blue Jeans,41961,3,A3AG3ZHG78N4M5,Boys
Chhota Bheem Kids Boys Holi Hai White T-shirt,21848,4,A2RVOYJID9VRWB,Boys
Gini and Jony Boys Rugby Green T-shirt,41959,4,A3MAJQYU3YLDNZ,Boys
Gini and Jony Boys Printed Dark Navy T-Shirt,39843,4,AG2M6FTRU871A,Boys
Gini and Jony Boys Rodeo T-shirt,38991,1,A2QVNVQDMN8475,Boys
Gini Jony Boys White Shirt,36205,4,A3PY5FBUJIEVN,Boys
Disney Kids Boy's Yellow Polo Tshirt,2727,4,AC6GHPEJPZVLL,Boys
Gini and Jony Boys Customised Black Shorts,41992,1,A2GWY01R7H21UV,Boys
Gini and Jony Boys Surfs Up Black T-shirt,41966,2,A1PVXDCN1T3JTE,Boys
United Colors of Benetton Boys Boys Blue Washed Jeans,24995,4,A3IJ6N02VJSCHJ,Boys
Doodle Boys white Printed T-Shirt,52129,5,ANMLUD0CWX6NR,Boys
Disney Kids Boy's Orange Colour Blast Kidswear,4219,3,A1AQ8JT2A3UWMY,Boys
Avengers Boys Black Printed T-shirt,48245,5,AD3N805TN3RFS,Boys
Doodle Boys Printed White T-shirt,43692,2,A39O3YXBO2TX0A,Boys
